2014-09-19	Production of the catechol type siderophore bacillibactin by the honey bee pathogen paenibacillus larvae	larvae bacillibactin virulence gene structure analysis siderophore bacterial host 
2014-09-17	Effects of neonicotinoids and fipronil on non-target invertebrates	marine knowledge invertebrate freshwater terrestrial fipronil section effects ranging 
2014-09-15	Holistic screening of collapsing honey bee colonies in Spain: A case study	mellificae colony study trypanosomatids genetic strain colonies different collapse 
2014-09-12	Capillary electrophoresis-mass spectrometry as a new approach to analyze neonicotinoid insecticides	detection limits oxalic method limit standard applied mass neonicotinoid 
2014-09-01	Determination of nonylphenol ethoxylate and octylphenol ethoxylate surfactants in beehive samples by high performance liquid chromatography coupled to mass spectrometry	pollen liquid method mass performance wax concentrations high extracted 
2014-09-01	An inventory of documented diseases of african honeybees	information pathogens populations destructor recent declines caused effect continues 
2014-08-25	Assembly of recombinant israeli acute paralysis virus capsids	protein virus recombinant structural capsids precursor expression processing specific 
2014-08-21	On the Front Line: Quantitative Virus Dynamics in Honeybee (Apis mellifera L.) Colonies along a New Expansion Front of the Parasite Varroa destructor	virus infestation viral titres mite parasite host increase chain 
2014-08-19	Potential exposure of pollinators to neonicotinoid insecticides from the use of insecticide seed treatments in the mid-southern United States	seed neonicotinoid soil insecticides pollen levels samples insecticide wild 
2014-08-15	Parasite pressures on feral honey bees (Apis mellifera sp.)	feral managed colonies wing colony pathogen virus due population 
2014-08-01	Impact of chronic neonicotinoid exposure on honeybee colony performance and queen supersedure	neonicotinoid colonies colony genetic queen neonicotinoids performance animal pollen 
2014-08-01	Risk factors associated with the presence of Varroa destructor in honey bee colonies from east-central Argentina	destructor mite associated infestation management colonies risk beekeepers worldwide 
2014-08-01	Pesticides, food safety and integrated pest management	food pest human population management demand integrated negative pesticides 
2014-07-21	Honeybee colony disorder in crop areas: The role of pesticides and viruses	colony colonies disorders virus significant observed brood fungicides queen 
2014-07-17	Diet-dependent gene expression in honey bees: Honey vs. sucrose or high fructose corn syrup	expression involved sources nutritional differences carbohydrate alternative sucrose gene 
2014-07-14	Overview of Protection Goals for Pollinators	risk assessment use goal level pollination certain general goals 
2014-07-14	Assessing Exposure of Pesticides to Bees	exposure pesticide assessments discusses used employed chapter component methods 
2014-07-04	Delayed and time-cumulative toxicity of imidacloprid in bees, ants and termites	t toxicity nitro imidacloprid imidazole toxic benefit several challenge 
2014-07-03	Reviews of science for science librarians: An update on Honeybee Colony Collapse Disorder	articles literature presence higher despite pollinate wide entomology multifactorial 
2014-07-01	Pesticide residues in honeybees, honey and bee pollen by LC-MS/MS screening: Reported death incidents in honeybees	pollen presence values ranging method different cases samples matrices 
2014-06-23	Honey bee Apis mellifera parasites in the absence of Nosema ceranae fungi and Varroa destructor mites	colonies cell absence queen black free viruses sacbrood green 
2014-06-13	Increased tolerance and resistance to virus infections: A possible factor in the survival of Varroa destructor-resistant honey bees (Apis mellifera)	virus population resistance colony survived colonies mite cell black 
2014-06-11	Mapping large-area landscape suitability for honey bees to assess the influence of land-use change on sustainability of national pollination services	land pollination suitability drivers existing aimed scenario environmental programs 
2014-06-03	Propolis chemical composition and honeybee resistance against Varroa destructor	chemical propolis composition tolerant colonies colony results relationship apiary 
2014-05-30	Identifying suitable queen rearing sites of Apis mellifera mellifera at a regional scale using morphometrics	mellifera colonies hybridization ligustica breeding subspecies mean place release 
2014-05-30	The influence of genetic origin and its interaction with environmental effects on the survival of Apis Mellifera L. Colonies in Europe	local colonies survival survived environmental origin cause order affected 
2014-05-30	Occurrence of parasites and pathogens in honey bee colonies used in a European genotypeenvironment Interactions experimentrs 2010/2011 and 2011/2012	colonies virus colony experiment occurrence destructor pathogen loads analysed 
2014-05-13	Environmental fate of soil applied neonicotinoid insecticides in an irrigated potato agroecosystem	neonicotinoid water insecticides neonicotinoids mass harvest irrigation crop concentration 
2014-05-05	Dynamics of the presence of israeli acute paralysis virus in honey bee colonies with colony collapse disorder	colonies virus infectious healthy health actively chain polymerase amplification 
2014-04-30	QuEChERS-based method for the multiresidue analysis of pesticides in beeswax by LC-MS/MS and GC×GC-TOF	pesticide solid phase procedure mass residues wax dispersive yield 
2014-04-17	A draft genome of the honey bee trypanosomatid parasite crithidia mellificae	species mellificae genetic genome draft carbohydrate genes losses unique 
2014-04-16	Evaluation of the distribution and impacts of parasites, pathogens, and pesticides on honey bee (apis mellifera) populations in east Africa	parasite environmental correlated three hygienic survival colony host number 
2014-04-16	The bacterial communities associated with honey bee (apis mellifera) foragers	bacteria microbial pollen core crop corbicular found food lactic 
2014-04-09	Pesticide residues and bees - A risk assessment	risk risks exposure toxicity residue contaminated pesticides crops assessments 
2014-04-01	Esterases of Varroa destructor (Acari: Varroidae), parasitic mite of the honeybee	activity enzymes esterases drug resistance higher role present phosphatase 
2014-03-27	Cephalaria transsylvanica-based flower strips as potential food source for bees during dry periods in European Mediterranean basin countries	transsylvanica plant pollinators latter strips food seed showed pollination 
2014-03-19	Transcriptome analyses of the honeybee response to Nosema ceranae and insecticides	expression gene combination induced genes ceranae lead higher insecticides 
2014-03-10	Expression of varroa sensitive hygiene (VSH) in iranian honey bees (Apis mellifera meda)	selection mites infestation mite offers brood rich sources percentage 
2014-03-07	Xenobiotic effects on intestinal stem cell proliferation in adult honey bee (Apis mellifera L) workers	stem xenobiotics cell intestinal animal proliferation xenobiotic compounds used 
2014-03-01	Nosema ceranae and RNA viruses in European and Africanized honeybee colonies (Apis mellifera) in Uruguay	ceranae colonies virus may presented although infections races place 
2014-03-01	A Causal Analysis of Observed Declines in Managed Honey Bees (Apis mellifera)	causes reduced candidate managed overwinter causal categorized analysis used 
2014-03-01	Vespa velutina: A new invasive predator of honeybees in Europe	impact velutina species limit biological life development biology cycle 
2014-02-25	Honey bee-infecting plant virus with implications on honey bee colony health	virus plant tobacco discovery viruses will losses role findings 
2014-02-25	Critical issues facing New Zealand entomology	enhancing support entomological knowledge areas current invasive issues limiting 
2014-02-21	Africanized honey bees (Apis mellifera) have low infestation levels of the mite Varroa destructor in different ecological regions in Mexico	colonies temperate infestation rates region dry destructor lower genotype 
2014-02-20	Effect of bodily fluids from honey bee (apis mellifera) larvae on growth and genome-wide transcriptional response of the causal agent of american foulbrood disease (Paenibacillus larvae)	fluids larval growth larvae responses sugar genetic bacterial body 
2014-01-31	The distribution of Aspergillus spp. opportunistic parasites in hives and their pathogenicity to honey bees	larvae adult apiary tests pathogenicity disease determine high worker 
2014-01-29	Interactions between fungi and bacteria influence microbial community structure in the Megachile rotundata larval gut	drug insect fungal gut larval antibiotic bacterial caused changes 
2014-01-27	Pollen diet for in vitro rearing of africanized honey bee larvae, Apis mellifera (Hymenoptera: Apidae)	pollen larvae development larval mixtures receive protein survival two 
2014-01-08	Four common pesticides, their mixtures and a formulation solvent in the hive environment have high oral toxicity to honey bee larvae	toxicity chlorothalonil larval tested pesticide chemical pesticides fluvalinate coumaphos 
2014-01-01	Israeli Acute Paralysis Virus: Epidemiology, Pathogenesis and Implications for Honey Bee Health	virus host colony infection limiting genetic due study indicates 
2014-01-01	Honey bee health in apiaries in the Vale do Paraíba, São Paulo state, Southeastern Brazil	infestation destructor prevalence spores ceranae completely period pathogens presence 
2014-01-01	Immunogene and viral transcript dynamics during parasitic Varroa destructor mite infection of developing honey bee (Apis mellifera) pupae	immune genes mite wing expression immunosuppression destructor developing data 
2014-01-01	The architecture of the pollen hoarding syndrome in honey bees: Implications for understanding social evolution, behavioral syndromes, and selective breeding	genetic pollen syndrome hoarding social may architecture trait reproductive 
2014-01-01	Thiacloprid-Nosema ceranae interactions in honey bees: Host survivorship but not parasite reproduction is dependent on pesticide dose	stressors parasite thiacloprid commonly results health increase low range 
2014-01-01	Detection of spiroplasma melliferum in honey bee colonies in the US	melliferum infection colonies reported prevalence infections results spiroplasmas colony 
2014-01-01	Honey bee sociogenomics: A genome-scale perspective on bee social behavior and health	social genomic insights new genome caste physiological behavior comparative 
2014-01-01	Correlating the pollens gathered by APIS Mellifera with the landscape features in Western France	pollen landscape apiaries specific urban features gathered rural including 
2014-01-01	A comparison of the activities of Greek and Turkish propolis against Paenibacillus larvae	antimicrobial propolis collected activities use activity study samples larvae 
2014-01-01	Insulin-like peptide response to nutritional input in honey bee workers	diet high expression fed carbohydrates also homeostasis body low 
2014-01-01	Honey production of honey bee (Hymenoptera: Apidae) colonies with high and low Varroa destructor (Acari: Varroidae) infestation rates in eastern Canada	colonies mite significantly infestation rates population per group yields 
2014-01-01	High Varroa mite abundance influences chemical profiles of worker bees and mite-host preferences	mite mites abundance foragers nurses colony animal colonies within 
2014-01-01	Prevention of honeybee diseases	prevent diseases importance reduce amongst hives important adequate resist 
2014-01-01	Bee bread increases honeybee haemolymph protein and promote better survival despite of causing higher Nosema ceranae abundance in honeybees	protein parasite diet effect higher healthy levels natural data 
2014-01-01	Remote beehive monitoring using acoustic signals	data sensor ability use colony maintaining surveillance system diverse 
2014-01-01	Draft genome of Chilean honeybee (Apis mellifera) gut strain Lactobacillus kunkeei MP2	genome distributed strain first report size isolated kunkeei contigs 
2014-01-01	Evaluating exposure and potential effects on honeybee brood (Apis mellifera) development using glyphosate as an example	glyphosate brood exposure approach dose effects residues realistic colonies 
2014-01-01	Biodegradation of imidacloprid in an open compost pile	degradation aeruginosa piles imidacloprid one faster aerobic kept fifth 
2014-01-01	Paratransgenesis feasibility in the honeybee (Apis mellifera) using Fructobacillus fructosus commensal	genetic fluorescent lactis sequence lactic tools protein acid expressed 
2014-01-01	A survey of imidacloprid levels in water sources potentially frequented by honeybees (Apis mellifera) in the eastern USA	water sublethal limit samples environmental rural clustered livestock chosen 
2014-01-01	Mating disruption of the honeybee mite Varroa destructor under laboratory and field conditions	pheromone females spermatozoa host mites clearly cell presence brood 
2014-01-01	Nutrition affects longevity and gene expression in honey bee (Apis mellifera) workers	pollen workers fed jelly genes gene royal together caged 
2014-01-01	Sub-lethal exposure to neonicotinoids impaired honey bees winterization before proceeding to colony collapse disorder	colonies control six observed exposure instead opposite almost subsequently 
2014-01-01	Detection of Aethina tumida Murray (Coleoptera: Nitidulidae.) in Italy: Outbreaks and early reaction measures	apiaries infested tumida zone process colonies protection surveillance according 
2014-01-01	A national survey of managed honey bee 2012-2013 annual colony losses in the USA: Results from the Bee Informed Partnership	beekeepers loss mortality commercial colonies average overwintering colony losses 
2014-01-01	Identification of developmentally-specific kinotypes and mechanisms of Varroa mite resistance through whole-organism, kinome analysis of honeybee	peptide well mite protein global virus breeding viral susceptibility 
2014-01-01	Comparsion of two multiresidue methods for pesticide determination in pollen	method better analysis modified pesticide different using pesticides residues 
2014-01-01	Trace Analysis of Seven Neonicotinoid Insecticides in Bee Pollen by Solid-Liquid Extraction and Liquid Chromatography Coupled to Electrospray Ionization Mass Spectrometry	pollen ionization extraction neonicotinoids two mass corbicular method traces 
2014-01-01	A large-scale field study examining effects of exposure to clothianidin seed-treated canola on honey bee colony health development, and overwintering success	clothianidin canola exposure seed field control bloom grown summer 
2014-01-01	High levels of genetic diversity in Nosema ceranae within Apis mellifera colonies	genetic ceranae haplotypes isolates three polymerase host recent within 
2014-01-01	Following beekeeping: More-than-human practice in agrifood	among approach beekeeping social paper practice contemporary yet studies 
2014-01-01	Risks of neonicotinoid insecticides to honeybees	colony habitat causes application risk insect authors possible nervous 
2014-01-01	Nosema ceranae DNA in honey bee haemolymph and honey bee mite Varroa destructor	destructor mite found ceranae microsporidia suggest findings aim important 
2014-01-01	A survey on some factors potentially affecting losses of managed honey bee colonies in Luxembourg over the winters 2010/2011 and 2011/2012	losses hive control colony colonies varroa winter type use 
2014-01-01	Identification and abiotic stress response of a glutamine synthetase gene (AccGS) from the asiatic honeybee, apis cerana cerana (hymenoptera: Apidae)	stress expression gene showed enzyme environmental recombinant plays invertebrate 
2014-01-01	Contextualising pollination benefits: Effect of insecticide and fungicide use on fruit set and weight from bee pollination in lowbush blueberry	crop fruit pest two disease pollinator activity set insect 
2014-01-01	Graph theoretical modelling and analysis of fragile honey bee pollination network	pollination network parameters using assess agent theoretical colony mellifera 
2014-01-01	Honeybee pathogens and their management	pathogens colony diseases current increased beekeeping pathology due environmental 
2014-01-01	Slow bee paralysis virus and its transmission in honey bee pupae by varroa destructor	virus pupae mite infected acquisition transmission ten significant proportion 
2014-01-01	Analysis of the RdRp, intergenic and structural polyprotein regions, and the complete genome sequence of Kashmir bee virus from infected honeybees (Apis mellifera) in Korea	genotypes virus genome complete sequence paralysis reference nucleotide nine 
2014-01-01	Honey bees, neonicotinoids and bee incident reports: The Canadian situation	incidents data major exposure moderate dust planting due neonicotinoid 
2014-01-01	Cytotoxic effects of thiamethoxam in the midgut and malpighian tubules of Africanized Apis mellifera (Hymenoptera: Apidae)	insecticide thiamethoxam used organs midgut use sublethal dose crops 
2014-01-01	Autumn invasion rates of varroa destructor (Mesostigmata: Varroidae) into honey bee (Hymenoptera: Apidae) colonies and the resulting increase in mite populations	colonies invasion mites population growth colony per infested treated 
2014-01-01	Virulence and polar tube protein genetic diversity of Nosema ceranae (Microsporidia) field isolates from Northern and Southern Europe in honeybees (Apis mellifera iberiensis)	genetic isolates field infected found two differences morphology losses 
2014-01-01	A comparative study of environmental conditions, Bee management and the epidemiological situation in apiaries varying in the level of colony losses	virus paralysis wing mortality acute samples determining aimed situation 
2014-01-01	Colliding with reality: Liquid modernity and the environment	defining damage global long success utilized apparent combat feature 
2014-01-01	Protecting honey bees: identification of a new varroacide by in silico, in vitro, and in vivo studies	vivo pirimicarb data acid gene new amino molecular model 
2014-01-01	Determination of pesticide residues in honeybees using modified QUEChERS sample work-up and liquid chromatography-tandem mass spectrometry	samples pesticides method tandem mass liquid eliminate employing environmental 
2014-01-01	The immune response of the small interfering RNA pathway in the defense against bee viruses	viral viruses also immune virus higher major response titers 
2014-01-01	Quantifying and mapping ecosystem services: Demand and supply of pollination in the European Union	supply demand pollination spatial agricultural probability landscape habitat dependent 
2014-01-01	Differential insecticide susceptibility of the Neotropical stingless bee Melipona quadrifasciata and the honey bee Apis mellifera	mellifera toxicity insecticides less realistic quadrifasciata significant susceptible significantly 
2014-01-01	Resistance of developing honeybee larvae during chronic exposure to dietary nicotine	body nicotine stores larvae development affected comb effects scutellata 
2014-01-01	Differential proteomic analysis of midguts from Nosema ceranae-infected honeybees reveals manipulation of key host functions	ceranae protein worker host midgut biological mass involved first 
2014-01-01	A survey of managed honey bee colony losses in the Republic of South Africa - 2009 to 2011	beekeepers subspecies chalkbrood losses significant colonies using practices lost 
2014-01-01	Results of international standardised beekeeper surveys of colony losses for winter 2012-2013: Analysis of winter loss rates and mixed effects modelling of risk factors for winter loss	effects treatment variation random used colony factors allowing colonies 
2014-01-01	Pathogen-associated self-medication behavior in the honeybee Apis mellifera	compounds nurse colony microsporidian larvae also show feed inhibit 
2014-01-01	Sublethal neonicotinoid insecticide exposure reduces solitary bee reproductive success	effects neonicotinoid exposure influence fitness reproductive population pesticide impacts 
2014-01-01	Exposure to neonicotinoids influences the motor function of adult worker honeybees	function sublethal motor doses affect neonicotinoids exposure basic influence 
2014-01-01	Determining the origin of invasions and demonstrating a lack of enemy release from microsporidian pathogens in common wasps (Vespula vulgaris)	wasp infection rates native populations enemy microsporidian home invaded 
2014-01-01	Honey bee colonies act as reservoirs for two Spiroplasma facultative symbionts and incur complex, multiyear infection dynamics	species pathogens current melliferum countries samples colonies seasonal prevalence 
2014-01-01	Overwintered brood comb honey: Colony exposure to pesticide residues	brood residues overwintered pesticide extracted comb samples significantly coumaphos 
2014-01-01	Host species and developmental stage, but not host social structure, affects bacterial community structure in socially polymorphic bees	social host developmental transmission solitary communities associated pollinator bacterial 
2014-01-01	Impact of chronic exposure to a pyrethroid pesticide on bumblebees and interactions with a trypanosome parasite	workers impact colony exposure pesticide significant bumblebee interactions impacts 
2014-01-01	Bacterial chitinase with phytopathogen control capacity from suppressive soil revealed by functional metagenomics	crop fungal novel enzymes bacterial soil microbial gene disease 
2014-01-01	Mathematical Programming Models for Determining the Optimal Location of Beehives	following two apiary models locate number given theoretical pollen 
2014-01-01	Lethal and sub-lethal effects of thymol on honeybee (Apis mellifera) larvae reared in vitro	thymol food larval vitro larvae level theoretical exposure effects 
2014-01-01	Chronic impairment of bumblebee natural foraging behaviour induced by sublethal pesticide exposure	exposure foraging chronic pesticide effects individual behavioural performance acute 
2014-01-01	Presence of Nosema ceranae associated with honeybee queen introductions	replacement species observed presence islands queens distribution dispersion parallel 
2014-01-01	Pesticides, food safety and integrated pest management	food pest human population management demand integrated negative pesticides 
2014-01-01	Fifty years since silent spring	pesticide use environmental although development theory pest agriculture often 
2014-01-01	The 10 principles of food industry sustainability	food sustainability industry book progress potential topic order limited 
2014-01-01	Management of whitefly-transmitted viruses in open-field production systems	disease viruses resistance production insecticides due crops increase many 
2014-01-01	Insect acetylcholinesterase as a target for effective and environmentally safe insecticides	pest residue social insecticide current beneficial acetylcholinesterase data insects 
2013-12-27	Characterizing the infection-induced transcriptome of Nasonia vitripennis reveals a preponderance of taxonomically-restricted immune genes	immune genes novel high show significantly identify innate annotation 
2013-12-17	Microbial ecology of the hive and pollination landscape: Bacterial associates from floral nectar, the alimentary tract and stored food of honey bees (Apis mellifera)	bacterial bacteria results beebread core health identical many microbial 
2013-12-01	The body composition and enzymes of carbohydrate metabolism of Varroa destructor	content glycogen lipid metabolism research composition present major mg 
2013-12-01	The rhizobacterium Arthrobacter agilis produces dimethylhexadecylamine, a compound that inhibits growth of phytopathogenic fungi in vitro	growth inhibit tested may effect volatile compound methyl namely 
2013-12-01	Short- and long-term effects of neonicotinoid application in rice fields, on the mortality and colony collapse of honeybees (Apis mellifera)	rice dead colony hives number distance workers field placed 
2013-12-01	Effects of exposure of honey bee colonies to neonicotinoid seed-treated maize crops	maize pollen colonies flowering analyzed neonicotinoid effects plants mays 
2013-12-01	Toxic effects of pesticides to humans and enviroment	pesticides health associated also including may positively environment food 
2013-12-01	Towards the elements of successful insect RNAi	insect pest gene parasitic disease insects understanding application enhanced 
2013-11-05	Trace level determination of pyrethroid and neonicotinoid insecticides in beebread using acetonitrile-based extraction followed by analysis with ultra-high-performance liquid chromatography-tandem mass spectrometry	liquid extraction method analysis analytical day pyrethroids values low 
2013-11-01	Simultaneous determination of residues in pollen and high-fructose corn syrup from eight neonicotinoid insecticides by liquid chromatography-tandem mass spectrometry	pollen method mass potential validated eight g electrospray accuracy 
2013-11-01	Honey bee protein atlas at organ-level resolution	organs us gene capacity expression data together whole also 
2013-11-01	The development, validation and application of a GC-dual detector (NPD-ECD) multi-pesticide residue method for monitoring bee poisoning incidents	pesticides pesticide method gas used matrix solid pollution samples 
2013-11-01	Production of Solitary Bees for Pollination in the United States	pollen alfalfa provision visit flowers must agricultural much prior 
