2014-09-12	Capillary electrophoresis-mass spectrometry as a new approach to analyze neonicotinoid insecticides	method neonicotinoid detection limit limits capillary mass proposed oxalic 
2014-09-01	Determination of nonylphenol ethoxylate and octylphenol ethoxylate surfactants in beehive samples by high performance liquid chromatography coupled to mass spectrometry	liquid pollen method performance mass wax high concentrations phase 
2014-09-01	An inventory of documented diseases of african honeybees	information pathogens populations review draw geographic need continues exists 
2014-08-25	Assembly of recombinant israeli acute paralysis virus capsids	protein virus structural capsids recombinant viruses many expression specific 
2014-08-21	On the Front Line: Quantitative Virus Dynamics in Honeybee (Apis mellifera L.) Colonies along a New Expansion Front of the Parasite Varroa destructor	infestation virus titres viral mite parasite increasing increase chain 
2014-08-19	Potential exposure of pollinators to neonicotinoid insecticides from the use of insecticide seed treatments in the mid-southern United States	seed neonicotinoid pollen soil samples carried flowering wild detected 
2014-08-15	Parasite pressures on feral honey bees (Apis mellifera sp.)	feral managed wing colonies colony pathogen virus deformed wider 
2014-08-01	Impact of chronic neonicotinoid exposure on honeybee colony performance and queen supersedure	colony colonies neonicotinoid genetic exposure queen brood performance animal 
2014-08-01	Risk factors associated with the presence of Varroa destructor in honey bee colonies from east-central Argentina	destructor mite colonies infestation management risk beekeepers associated level 
2014-08-01	Pesticides, food safety and integrated pest management	food pest human population pesticide pesticides negative safety land 
2014-07-21	Honeybee colony disorder in crop areas: The role of pesticides and viruses	colony colonies virus disorders observed significant brood queen environmental 
2014-07-17	Diet-dependent gene expression in honey bees: Honey vs. sucrose or high fructose corn syrup	expression involved differences carbohydrate sucrose gene genes sources alternative 
2014-07-14	Overview of Protection Goals for Pollinators	assessment risk use goal level pollination certain consistent services 
2014-07-14	Assessing Exposure of Pesticides to Bees	exposure pesticide employed chapter discusses used assessments different risk 
2014-07-04	Delayed and time-cumulative toxicity of imidacloprid in bees, ants and termites	t toxicity toxic imidazole nitro imidacloprid curves lifespan scale 
2014-07-03	Reviews of science for science librarians: An update on Honeybee Colony Collapse Disorder	presence literature despite higher articles pollinate significance crops wide 
2014-07-01	Pesticide residues in honeybees, honey and bee pollen by LC-MS/MS screening: Reported death incidents in honeybees	pollen ranging values presence method cases matrices different pesticide 
2014-06-23	Honey bee Apis mellifera parasites in the absence of Nosema ceranae fungi and Varroa destructor mites	colonies free parasites absence ceranae green apis black destructor 
2014-06-13	Increased tolerance and resistance to virus infections: A possible factor in the survival of Varroa destructor-resistant honey bees (Apis mellifera)	virus population resistance mite colony autumn titres sacbrood colonies 
2014-06-11	Mapping large-area landscape suitability for honey bees to assess the influence of land-use change on sustainability of national pollination services	environmental land suitability existing market programs series aimed scenario 
2014-06-03	Propolis chemical composition and honeybee resistance against Varroa destructor	chemical propolis composition colonies tolerant relationship colony results apiary 
2014-05-30	Identifying suitable queen rearing sites of Apis mellifera mellifera at a regional scale using morphometrics	mellifera colonies ligustica hybridization subspecies mean breeding wings slight 
2014-05-30	The influence of genetic origin and its interaction with environmental effects on the survival of Apis Mellifera L. Colonies in Europe	colonies local survival origin environmental survived productivity representing colony 
2014-05-30	Occurrence of parasites and pathogens in honey bee colonies used in a European genotypeenvironment Interactions experimentrs 2010/2011 and 2011/2012	colonies colony experiment virus occurrence set levels one within 
2014-05-13	Environmental fate of soil applied neonicotinoid insecticides in an irrigated potato agroecosystem	neonicotinoid application water crop neonicotinoids irrigation mass groundwater harvest 
2014-05-05	Dynamics of the presence of israeli acute paralysis virus in honey bee colonies with colony collapse disorder	colonies infectious virus recovered actively healthy collapse chain polymerase 
2014-04-30	QuEChERS-based method for the multiresidue analysis of pesticides in beeswax by LC-MS/MS and GC×GC-TOF	phase solid pesticide dispersive procedure mass residues particle load 
2014-04-17	A draft genome of the honey bee trypanosomatid parasite crithidia mellificae	species mellificae genetic unique draft carbohydrate increased losses including 
2014-04-16	Evaluation of the distribution and impacts of parasites, pathogens, and pesticides on honey bee (apis mellifera) populations in east Africa	parasite environmental correlated hygienic factors three colony impact appear 
2014-04-16	The bacterial communities associated with honey bee (apis mellifera) foragers	microbial pollen core crop bacteria corbicular food studies forager 
2014-04-09	Pesticide residues and bees - A risk assessment	risk risks toxicity exposure residue contaminated evaluation inhibiting highest 
2014-04-01	Esterases of Varroa destructor (Acari: Varroidae), parasitic mite of the honeybee	activity enzymes esterases drug role resistance higher present phosphatase 
2014-03-27	Cephalaria transsylvanica-based flower strips as potential food source for bees during dry periods in European Mediterranean basin countries	transsylvanica plant pollinators strips paucity latter food terms seed 
2014-03-19	Transcriptome analyses of the honeybee response to Nosema ceranae and insecticides	expression gene combination insecticides lead induced ceranae genes impact 
2014-03-10	Expression of varroa sensitive hygiene (VSH) in iranian honey bees (Apis mellifera meda)	selection brood mites rich offers natural colonies sources infestation 
2014-03-07	Xenobiotic effects on intestinal stem cell proliferation in adult honey bee (Apis mellifera L) workers	stem xenobiotics cell intestinal proliferation animal cells midgut intestine 
2014-03-01	Nosema ceranae and RNA viruses in European and Africanized honeybee colonies (Apis mellifera) in Uruguay	virus ceranae presented colonies although allow larger may place 
2014-03-01	A Causal Analysis of Observed Declines in Managed Honey Bees (Apis mellifera)	causes reduced candidate overwinter causal categorized analysis managed hives 
2014-03-01	Vespa velutina: A new invasive predator of honeybees in Europe	velutina species impact life cycle development biology biological review 
2014-02-25	Honey bee-infecting plant virus with implications on honey bee colony health	virus plant tobacco findings role viruses discovery losses will 
2014-02-25	Critical issues facing New Zealand entomology	enhancing knowledge current areas limiting invasive support entomological issues 
2014-02-21	Africanized honey bees (Apis mellifera) have low infestation levels of the mite Varroa destructor in different ecological regions in Mexico	colonies infestation rates dry genotype region temperate ecological destructor 
2014-02-20	Effect of bodily fluids from honey bee (apis mellifera) larvae on growth and genome-wide transcriptional response of the causal agent of american foulbrood disease (Paenibacillus larvae)	fluids larvae larval growth sugar bacterial body general vitro 
2014-01-31	The distribution of Aspergillus spp. opportunistic parasites in hives and their pathogenicity to honey bees	larvae adult disease high studies worker tests pathogenicity fungi 
2014-01-29	Interactions between fungi and bacteria influence microbial community structure in the Megachile rotundata larval gut	drug fungal gut insect antibiotic bacteria changes growth larval 
2014-01-27	Pollen diet for in vitro rearing of africanized honey bee larvae, Apis mellifera (Hymenoptera: Apidae)	pollen larvae receive mixtures brood development adults two larval 
2014-01-08	Four common pesticides, their mixtures and a formulation solvent in the hive environment have high oral toxicity to honey bee larvae	larvae larval chlorothalonil toxicity pesticide tested pesticides chemical fluvalinate 
2014-01-01	Israeli Acute Paralysis Virus: Epidemiology, Pathogenesis and Implications for Honey Bee Health	host virus colony infection chain responses study expression polymerase 
2014-01-01	Honey bee health in apiaries in the Vale do Paraíba, São Paulo state, Southeastern Brazil	period prevalence destructor pathogens infestation brood health adult spores 
2014-01-01	Immunogene and viral transcript dynamics during parasitic Varroa destructor mite infection of developing honey bee (Apis mellifera) pupae	immune expression genes wing immunosuppression developing mite destructor virus 
2014-01-01	The architecture of the pollen hoarding syndrome in honey bees: Implications for understanding social evolution, behavioral syndromes, and selective breeding	genetic syndrome hoarding pollen social may trait architecture reproductive 
2014-01-01	Thiacloprid-Nosema ceranae interactions in honey bees: Host survivorship but not parasite reproduction is dependent on pesticide dose	parasite stressors host thiacloprid nearly low interactions highlight losses 
2014-01-01	Detection of spiroplasma melliferum in honey bee colonies in the US	melliferum reported colonies infection prevalence infections intensive peak remains 
2014-01-01	Honey bee sociogenomics: A genome-scale perspective on bee social behavior and health	social new insights genomic behavior data insect provided expression 
2014-01-01	Correlating the pollens gathered by APIS Mellifera with the landscape features in Western France	landscape pollen apiaries specific urban features gathered collected using 
2014-01-01	A comparison of the activities of Greek and Turkish propolis against Paenibacillus larvae	antimicrobial propolis collected activities activity different samples larvae extracts 
2014-01-01	Insulin-like peptide response to nutritional input in honey bee workers	diet high also expression fed carbohydrates dietary potentially worker 
2014-01-01	Honey production of honey bee (Hymenoptera: Apidae) colonies with high and low Varroa destructor (Acari: Varroidae) infestation rates in eastern Canada	colonies mite significantly infestation group rates yields per population 
2014-01-01	High Varroa mite abundance influences chemical profiles of worker bees and mite-host preferences	mite mites colony within animal chemical foragers colonies nurses 
2014-01-01	Prevention of honeybee diseases	important diseases prevent importance reduce hives using brood least 
2014-01-01	Bee bread increases honeybee haemolymph protein and promote better survival despite of causing higher Nosema ceranae abundance in honeybees	protein diet parasite higher effect natural healthy concerning efficiently 
2014-01-01	Remote beehive monitoring using acoustic signals	data sensor colony system ability use determined range associated 
2014-01-01	Draft genome of Chilean honeybee (Apis mellifera) gut strain Lactobacillus kunkeei MP2	genome report et first sequence sequenced isolated kunkeei contigs 
2014-01-01	Evaluating exposure and potential effects on honeybee brood (Apis mellifera) development using glyphosate as an example	glyphosate residues pollen exposure colonies approach effects brood observed 
2014-01-01	Biodegradation of imidacloprid in an open compost pile	aeruginosa piles degradation imidacloprid one aerobic faster conditions spontaneous 
2014-01-01	Paratransgenesis feasibility in the honeybee (Apis mellifera) using Fructobacillus fructosus commensal	genetic lactis carbon expressed protein tools sequence acid lactic 
2014-01-01	A survey of imidacloprid levels in water sources potentially frequented by honeybees (Apis mellifera) in the eastern USA	limit water sublethal samples rural livestock chosen numerous enzyme 
2014-01-01	Mating disruption of the honeybee mite Varroa destructor under laboratory and field conditions	pheromone mites females host spermatozoa brood clearly presence number 
2014-01-01	Nutrition affects longevity and gene expression in honey bee (Apis mellifera) workers	workers fed pollen jelly together royal genes role affected 
2014-01-01	Sub-lethal exposure to neonicotinoids impaired honey bees winterization before proceeding to colony collapse disorder	colonies control exposure six observed caused fall appeared due 
2014-01-01	Detection of Aethina tumida Murray (Coleoptera: Nitidulidae.) in Italy: Outbreaks and early reaction measures	apiaries tumida colonies infested zone surveillance process according protection 
2014-01-01	A national survey of managed honey bee 2012-2013 annual colony losses in the USA: Results from the Bee Informed Partnership	beekeepers loss colonies winter overwintering mortality commercial losses backyard 
2014-01-01	Identification of developmentally-specific kinotypes and mechanisms of Varroa mite resistance through whole-organism, kinome analysis of honeybee	peptide breeding susceptible mite biomarkers well infestation viral susceptibility 
2014-01-01	Comparsion of two multiresidue methods for pesticide determination in pollen	method better pesticide modified conventional different pesticides analysis found 
2014-01-01	Trace Analysis of Seven Neonicotinoid Insecticides in Bee Pollen by Solid-Liquid Extraction and Liquid Chromatography Coupled to Electrospray Ionization Mass Spectrometry	pollen two neonicotinoids ionization mass extraction method corbicular close 
2014-01-01	A large-scale field study examining effects of exposure to clothianidin seed-treated canola on honey bee colony health development, and overwintering success	clothianidin exposure canola control field seed summer bloom colony 
2014-01-01	High levels of genetic diversity in Nosema ceranae within Apis mellifera colonies	genetic haplotypes ceranae isolates protein heat host within pathogen 
2014-01-01	Following beekeeping: More-than-human practice in agrifood	approach among beekeeping contemporary yet social paper practice setting 
2014-01-01	Risks of neonicotinoid insecticides to honeybees	colony nervous modified application low insect habitat risk authors 
2014-01-01	Nosema ceranae DNA in honey bee haemolymph and honey bee mite Varroa destructor	destructor mite found microsporidia ceranae infect distant important distribution 
2014-01-01	A survey on some factors potentially affecting losses of managed honey bee colonies in Luxembourg over the winters 2010/2011 and 2011/2012	losses hive colony control varroa winter type colonies agricultural 
2014-01-01	Identification and abiotic stress response of a glutamine synthetase gene (AccGS) from the asiatic honeybee, apis cerana cerana (hymenoptera: Apidae)	stress enzyme gene showed environmental expression stages regulated instar 
2014-01-01	Contextualising pollination benefits: Effect of insecticide and fungicide use on fruit set and weight from bee pollination in lowbush blueberry	fruit crop two pest disease activity pollinator set insect 
2014-01-01	Graph theoretical modelling and analysis of fragile honey bee pollination network	pollination network mellifera environmental using foraging stress agent agents 
2014-01-01	Honeybee pathogens and their management	pathogens colony diseases current increased last play focus measures 
2014-01-01	Slow bee paralysis virus and its transmission in honey bee pupae by varroa destructor	virus pupae mite infected transmission mites ten five significant 
2014-01-01	Analysis of the RdRp, intergenic and structural polyprotein regions, and the complete genome sequence of Kashmir bee virus from infected honeybees (Apis mellifera) in Korea	virus reference genotypes complete paralysis shared phylogenetic highly sequence 
2014-01-01	Honey bees, neonicotinoids and bee incident reports: The Canadian situation	incidents data report due neonicotinoid exposure reported major suspected 
2014-01-01	Cytotoxic effects of thiamethoxam in the midgut and malpighian tubules of Africanized Apis mellifera (Hymenoptera: Apidae)	insecticide thiamethoxam used organs cells midgut neonicotinoids effects showed 
2014-01-01	Autumn invasion rates of varroa destructor (Mesostigmata: Varroidae) into honey bee (Hymenoptera: Apidae) colonies and the resulting increase in mite populations	invasion colonies mites population per treatment compared growth colony 
2014-01-01	Virulence and polar tube protein genetic diversity of Nosema ceranae (Microsporidia) field isolates from Northern and Southern Europe in honeybees (Apis mellifera iberiensis)	genetic isolates field morphology virulence microsporidian evidence differences differ 
2014-01-01	A comparative study of environmental conditions, Bee management and the epidemiological situation in apiaries varying in the level of colony losses	paralysis virus wing acute samples mortality relationship determining situation 
2014-01-01	Colliding with reality: Liquid modernity and the environment	damage long defining global success much shown future measures 
2014-01-01	Protecting honey bees: identification of a new varroacide by in silico, in vitro, and in vivo studies	acid amino vivo gene data pirimicarb molecular new candidate 
2014-01-01	Determination of pesticide residues in honeybees using modified QUEChERS sample work-up and liquid chromatography-tandem mass spectrometry	samples mass method liquid tandem pesticides one chemical spectrometry 
2014-01-01	The immune response of the small interfering RNA pathway in the defense against bee viruses	viral viruses immune virus response also major higher namely 
2014-01-01	Quantifying and mapping ecosystem services: Demand and supply of pollination in the European Union	pollination supply demand agricultural visitation probability spatial ecosystem crop 
2014-01-01	Differential insecticide susceptibility of the Neotropical stingless bee Melipona quadrifasciata and the honey bee Apis mellifera	mellifera toxicity significant less susceptible realistic quadrifasciata insecticides results 
2014-01-01	Resistance of developing honeybee larvae during chronic exposure to dietary nicotine	nicotine body stores affected effects larvae development scutellata accumulate 
2014-01-01	Differential proteomic analysis of midguts from Nosema ceranae-infected honeybees reveals manipulation of key host functions	ceranae protein invasive midgut host first modulation worker ensure 
2014-01-01	A survey of managed honey bee colony losses in the Republic of South Africa - 2009 to 2011	beekeepers chalkbrood losses practices colony subspecies lost using scutellata 
2014-01-01	Results of international standardised beekeeper surveys of colony losses for winter 2012-2013: Analysis of winter loss rates and mixed effects modelling of risk factors for winter loss	effects treatment random allowing beekeeper factors used colonies treatments 
2014-01-01	Pathogen-associated self-medication behavior in the honeybee Apis mellifera	compounds microsporidian colony larvae nurse also show several inside 
2014-01-01	Sublethal neonicotinoid insecticide exposure reduces solitary bee reproductive success	effects neonicotinoid exposure pollinator pesticide sublethal present impacts offspring 
2014-01-01	Exposure to neonicotinoids influences the motor function of adult worker honeybees	motor function exposure doses pesticides neonicotinoids sublethal influence control 
2014-01-01	Determining the origin of invasions and demonstrating a lack of enemy release from microsporidian pathogens in common wasps (Vespula vulgaris)	wasp infection enemy invaded pathogens populations native microsporidian home 
2014-01-01	Honey bee colonies act as reservoirs for two Spiroplasma facultative symbionts and incur complex, multiyear infection dynamics	species colonies pathogens bacterium melliferum samples prevalence seasonal molecular 
2014-01-01	Overwintered brood comb honey: Colony exposure to pesticide residues	brood overwintered residues pesticide significantly extracted comb samples stored 
2014-01-01	Host species and developmental stage, but not host social structure, affects bacterial community structure in socially polymorphic bees	social host developmental bacterial communities associated transmission kunkeei appeared 
2014-01-01	Impact of chronic exposure to a pyrethroid pesticide on bumblebees and interactions with a trypanosome parasite	pesticide colony impact workers exposure impacts bumblebee wild population 
2014-01-01	Bacterial chitinase with phytopathogen control capacity from suppressive soil revealed by functional metagenomics	fungal crop disease novel enzymes gene activity soil bacterial 
2014-01-01	Mathematical Programming Models for Determining the Optimal Location of Beehives	apiary models following given two number linear lead develop 
2014-01-01	Lethal and sub-lethal effects of thymol on honeybee (Apis mellifera) larvae reared in vitro	thymol food vitro larval exposure effects level larvae theoretical 
2014-01-01	Chronic impairment of bumblebee natural foraging behaviour induced by sublethal pesticide exposure	exposure chronic pesticide foraging prolonged performance behavioural essential reports 
2014-01-01	Presence of Nosema ceranae associated with honeybee queen introductions	replacement species queens islands ceranae distribution observed presence mainly 
2014-01-01	Pesticides, food safety and integrated pest management	food pest human population pesticides land pesticide negative management 
2014-01-01	Fifty years since silent spring	pesticide use environmental pest risk observed development consequences pesticides 
2014-01-01	The 10 principles of food industry sustainability	food sustainability industry progress book potential topic order growing 
2014-01-01	Management of whitefly-transmitted viruses in open-field production systems	disease viruses resistance production host selected strategies leaf mosaic 
2014-01-01	Insect acetylcholinesterase as a target for effective and environmentally safe insecticides	pest residue beneficial insecticide acetylcholinesterase social insects data current 
2013-12-27	Characterizing the infection-induced transcriptome of Nasonia vitripennis reveals a preponderance of taxonomically-restricted immune genes	immune genes novel proportion show high identify functional innate 
2013-12-17	Microbial ecology of the hive and pollination landscape: Bacterial associates from floral nectar, the alimentary tract and stored food of honey bees (Apis mellifera)	bacterial bacteria core results food many health microbial beebread 
2013-12-01	The body composition and enzymes of carbohydrate metabolism of Varroa destructor	content glycogen lipid metabolism research basic composition mite mg 
2013-12-01	The rhizobacterium Arthrobacter agilis produces dimethylhexadecylamine, a compound that inhibits growth of phytopathogenic fungi in vitro	growth inhibit methyl tested compound volatile effect may caused 
2013-12-01	Short- and long-term effects of neonicotinoid application in rice fields, on the mortality and colony collapse of honeybees (Apis mellifera)	rice dead hives colony placed workers effects field number 
2013-12-01	Effects of exposure of honey bee colonies to neonicotinoid seed-treated maize crops	maize pollen flowering colonies plants analyzed mays effects neonicotinoid 
2013-12-01	Toxic effects of pesticides to humans and enviroment	pesticides health also associated food damage positively residential may 
2013-12-01	Towards the elements of successful insect RNAi	insect gene pest insects parasitic disease understanding application manage 
2013-11-05	Trace level determination of pyrethroid and neonicotinoid insecticides in beebread using acetonitrile-based extraction followed by analysis with ultra-high-performance liquid chromatography-tandem mass spectrometry	liquid analysis method beebread pyrethroids sensitive day based extraction 
2013-11-01	Simultaneous determination of residues in pollen and high-fructose corn syrup from eight neonicotinoid insecticides by liquid chromatography-tandem mass spectrometry	pollen electrospray eight mass potential method g contributing corn 
2013-11-01	Honey bee protein atlas at organ-level resolution	organs us gene expression whole data together protein workers 
2013-11-01	The development, validation and application of a GC-dual detector (NPD-ECD) multi-pesticide residue method for monitoring bee poisoning incidents	pesticide method pesticides used matrix gas suspected poisoning g 
2013-11-01	Production of Solitary Bees for Pollination in the United States	pollen provision flowers alfalfa visit increase diverse species nectar 
2013-10-25	Influence of agrochemicals fipronil and imidacloprid on the learning behavior of Apis mellifera L. honeybees	fipronil learning determined imidacloprid mellifera food cultivated difference disorders 
2013-10-24	The Effect of Olfactory Exposure to Non-Insecticidal Agrochemicals on Bumblebee Foraging Behavior	effects foraging food within olfactory bumblebee agrochemical agrochemicals fungicide 
2013-10-23	A Four-Year Field Program Investigating Long-Term Effects of Repeated Exposure of Honey Bee Colonies to Flowering Crops Treated with Thiamethoxam	residues pollen oilseed rape nectar foraging thiamethoxam treated maize 
