2016-06-15	Why do Varroa mites prefer nurse bees?	mites host mite nurses preference show adapted also determined 
2016-06-01	B+WSN: Smart beehive with preliminary decision tree analysis for agriculture and honey bee health monitoring	data algorithm beehive classification parameters sensor important biological decision 
2016-06-01	Sucrose sensitivity of honey bees is differently affected by dietary protein and a neonicotinoid pesticide	protein sucrose drug thiamethoxam food effects carbohydrate colony unbalanced 
2016-06-01	Specific immune stimulation by endogenous bacteria in honey bees (Hymenoptera: Apidae)	bacteria immune associated strains immunomodulatory potential species environmental endogenous 
2016-06-01	Sperm viability and gene expression in honey bee queens (Apis mellifera) following exposure to the neonicotinoid insecticide imidacloprid and the organophosphate acaricide coumaphos	expression doses queens viability day compounds coumaphos genes chemical 
2016-06-01	Selective Behaviour of Honeybees in Acquiring European Propolis Plant Precursors	resins bud antimicrobial black sources species selective plant resin 
2016-06-01	Honeybees produce millimolar concentrations of non-neuronal acetylcholine for breeding: Possible adverse effects of neonicotinoids	brood food neonicotinoids larval gland concentrations content survival well 
2016-06-01	Varroa destructor and viruses association in honey bee colonies under different climatic conditions	colonies virus treatment subtropical climate received temperate infestation four 
2016-06-01	Isoform-specific modulation of the chemical sensitivity of conserved TRPA1 channel in the major honeybee ectoparasitic mite, Tropilaelaps mercedesae	channel mercedesae one two activated compounds chemical arthropod ectoparasitic 
2016-06-01	Rapid and Reliable Method for Analyzing Acaricides in Honey-Based Products	analytical products range limits solution standard method calibration gas 
2016-06-01	Food for pollinators: Quantifying the nectar and pollen resources of urban flower meadows	pollen resource mixes seed flower per resources species nectar 
2016-05-31	Non-cultivated plants present a season-long route of pesticide exposure for honey bees	pollen neonicotinoid foraging insecticides growing levels exposure used plants 
2016-05-07	MelissAR: Towards augmented visual analytics of honey bee behaviour	based system design effective implementation reality relevant support populations 
2016-05-01	The status of honey bee health in Italy: Results from the nationwide bee monitoring network	colony health mortality land samples hive network monitoring seasonal 
2016-05-01	Weakness and collapse of bee colonies in Brazil: Are there cases of CCD?	collapse colonies studies pathogens causes possible recorded mainly pesticides 
2016-05-01	Chronic toxicity and physiological changes induced in the honey bee by the exposure to fipronil and Bacillus thuringiensis spores alone or combined	physiological enzyme effects bacterial phosphate spores days glucose biological 
2016-05-01	Acute exposure to selenium disrupts associative conditioning and long-term memory recall in honey bees (Apis mellifera)	selenium sublethal exposure memory conditioning learning form ability recall 
2016-05-01	A toolbox for quantitative gene expression in varroa destructor: RNA degradation in field samples and systematic analysis of reference gene stability	gene genes expression quality stable studies chain reference high 
2016-05-01	Natural Varroa mite-surviving Apis mellifera honeybee populations	populations destructor mite survival wild around mellifera mites pest 
2016-05-01	Disease dynamics of honeybees with Varroa destructor as parasite and virus vector	virus mites parasitic effects phoretic brood adult reproductive population 
2016-05-01	Multiyear survey targeting disease incidence in US honey bees	disease paralysis destructor virus across positive prevalence loads eight 
2016-05-01	Modulation of pesticide response in honeybees	response variability environmental risk factors assessment conditions health physiological 
2018-02-15	A 3-year survey of Italian honey bee-collected pollen reveals widespread contamination by agricultural pesticides	pesticide samples environmental pesticides higher pollen insecticide least dietary 
2018-02-14	Study of the metatranscriptome of eight social and solitary wild bee species reveals novel viruses and bee parasites	viruses species wild including virus plant sequencing high associated 
2018-02-08	Short-Term Exposure to Lambda-Cyhalothrin Negatively Affects the Survival and Memory-Related Characteristics of Worker Bees Apis mellifera	
2018-02-08	Effects of neonicotinoid imidacloprid exposure on bumble bee (Hymenoptera: Apidae) queen survival and nest initiation	queen may nest queens bumble become imidacloprid survival study 
2018-02-01	The immunological dependence of plant-feeding animals on their host’s medical properties may explain part of honey bee colony losses	properties also declines may plant secondary colony dependence medicinal 
2018-02-01	Nosema ceranae disease of the honey bee (Apis mellifera)	ceranae observations pathology effects poor research thought well showing 
2018-02-01	Specialty oilseed crops provide an abundant source of pollen for pollinators and beneficial insects	oilseed pollen crops production beneficial oilseeds alternative produce potentially 
2018-02-01	Reproduction of parasitic mites Varroa destructor in original and new honeybee hosts	host mite reproduction hosts due new original trait lack 
2018-02-01	Characterization of gut bacterial flora of Apis mellifera from north-west Pakistan	gut bacterial beneficial isolates microbiota bacteria report several study 
2018-02-01	Stress decreases pollen foraging performance in honeybees	foraging pollen metabolic behaviour reduced nectar flight higher octopamine 
2018-02-01	From field to food—will pesticide-contaminated pollen diet lead to a contamination of royal jelly?	pesticides used queen contamination low fed concentrations jelly reasons 
2018-02-01	Genomes of the Hymenoptera	genomes least needed sequencing assembly sequenced genome progress represent 
2018-01-15	Classical and geometric morphometric methods reveal differences between specimens of Varroa destructor (Mesostigmata: Varroidae) from seven provinces of Iran	morphometric geometric specimens used analysis length six methods located 
2018-01-07	Nutritional Physiology and Ecology of Honey Bees	pollen colony food jelly around colonies feed growing shows 
2018-01-02	Determining the minimum number of pollen grains needed for accurate honey bee (Apis mellifera) colony pollen pellet analysis	pollen floral taxa taxonomic found three count grains minor 
2018-01-01	Using colony monitoring devices to evaluate the impacts of land use and nutritional value of forage on honey bee health	colony weight growing health two pollen used devices scales 
2018-01-01	Lactobacillus kunkeei strains decreased the infection by honey bee pathogens Paenibacillus larvae and Nosema ceranae	larvae ceranae improve beneficial adult mixture effect infected infectious 
2018-01-01	Lethal effects of Cr(III) alone and in combination with propiconazole and clothianidin in honey bees	clothianidin heavy propiconazole combination mellifera antagonistic toxicity low agricultural 
2018-01-01	Epormenis cestri secretions in Sebastiania schottiana trees cause mass death of honey bee Apis mellifera larvae in Uruguay	nectar larvae mortality secretions affected abundant located healthy colony 
2018-01-01	The impact of selected pesticides on honey bees	pesticides plant elements tested presence study survival concentration impact 
2018-01-01	Primary data in pollination services mapping: potential service provision by honey bees (Apis mellifera) in Cumberland and Colchester, Nova Scotia	model ecosystem data field services utilized using resource pollination 
2018-01-01	Honey yield of different commercial apiaries treated with Lactobacillus salivarius A3iob, a new bee-probiotic strain	hives treated higher main yield fed impact administered another 
2018-01-01	Honey bee (Apis mellifera) nurses do not consume pollens based on their nutritional quality	nutritional pollens nurses protein pollen different prefer diets liquid 
2018-01-01	Mitigating effects of pollen during paraquat exposure on gene expression and pathogen prevalence in Apis mellifera L	gene pollen oxidative well effects survival genes reported pathogen 
2018-01-01	Effect of pollen extract supplementation on the varroatosis tolerance of honey bee (Apis mellifera) larvae reared in vitro	pollen tolerance weight larval loss development supplementation polyfloral physiological 
2018-01-01	The first report of the prevalence of Nosema ceranae in Bulgaria	ceranae species apis polymerase results chain samples showed main 
2018-01-01	Decline of bumble bees in northeastern North America, with special focus on Bombus terricola	conservation species regions records population may decline found severe 
2018-01-01	Comparative chronic toxicity of three neonicotinoids on New Zealand packaged honey bees	weight population size neonicotinoids environmental sublethal exposure area colonies 
2018-01-01	Impact of beneficial bacteria supplementation on the gut microbiota, colony development and productivity of Apis mellifera L.	gut hives generation brood microbiota pollen investigated field increase 
2018-01-01	COREMIC: A web-tool to search for a niche associated CORE MICrobiome	core diverse identify habitat great used set using related 
2018-01-01	The impact of restrictions on neonicotinoid and fipronil insecticides on pest management in maize, oilseed rape and sunflower in eight European Union regions	farmers seed case treatments restricted pest management using behalf 
2018-01-01	Metabolisation of thiamethoxam (a neonicotinoid pesticide) and interaction with the Chronic bee paralysis virus in honeybees	viral dose increase virus thiamethoxam investigated show synergistic pesticides 
2018-01-01	Bacterial communities associated with the ectoparasitic mites Varroa destructor and Tropilaelaps mercedesae of the honey bee (Apis mellifera)	mites bacteria bacterial operational sequences obtained family destructor taxonomic 
2018-01-01	Increased survival of honeybees in the laboratory after simultaneous exposure to low doses of pesticides and bacteria	exposed thiacloprid insecticide survival effects bacteria show bacterium higher 
2017-12-20	Neonicotinoid pesticides and nutritional stress synergistically reduce survival in honey bees	pesticide stress food health nectar nutritional pollinator access pesticides 
2017-12-15	Occurrence of pesticide residues in Spanish beeswax	old pesticide mass combs contaminated pesticides applied used beeswax 
2017-12-12	Presence of Apis rhabdovirus-1 in populations of pollinators and their parasites from two continents	virus presence found viruses mellifera destructor shared mites across 
2017-12-01	Comparative flight activities and pathogen load of two stocks of honey bees reared in gamma-irradiated combs	combs foraging irradiation reared flight may pollen total impact 
2017-12-01	Behavioral responses of honey bees (Apis mellifera) to natural and synthetic xenobiotics in food	pesticides ubiquitous preference five risk health phytochemicals frequency floral 
2017-12-01	Elucidating the mechanisms underlying the beneficial health effects of dietary pollen on honey bees (Apis mellifera) infested by Varroa mite ectoparasites	pollen effects observed colony mite possible development use used 
2017-12-01	Recent spread of Varroa destructor virus-1, a honey bee pathogen, in the United States	virus present colony second tested viruses next colonies rates 
2017-12-01	A Varroa destructor protein atlas reveals molecular underpinnings of developmental transitions and sexual differentiation	protein proteins developmental biological differentially sex destructor colonies expressed 
2017-12-01	Peptide biomarkers used for the selective breeding of a complex polygenic trait in honey bees	markers protein expression hygienic breeding stock livestock select genomic 
2017-12-01	An abbreviated SNP panel for ancestry assignment of honeybees (Apis mellifera)	semen single mixed genetic countries polymorphisms detect individually facilitated 
2017-12-01	Apitoxin harvest impairs hypopharyngeal gland structure in Apis mellifera honey bees	treatment subjected hives ten hypopharyngeal area harvesting harvest number 
2017-12-01	Temporal dynamics of whole body residues of the neonicotinoid insecticide imidacloprid in live or dead honeybees	residues decrease samples light exposure imidacloprid significantly reduced acute 
2017-12-01	Chemical characterization and acaricidal activity of Thymus satureioides C. &amp; B. and Origanum elongatum E. &amp; M. (Lamiaceae) essential oils against Varroa destructor Anderson &amp; Trueman (Acari: Varroidae)	carvacrol satureioides thymol foraging essential growth activity composition effect 
2017-12-01	Efficacy of extracts from eight economically important forestry species against grapevine downy mildew (Plasmopara viticola) and identification of active constituents	compounds species extracts pathogen active low acid showed eight 
2017-12-01	Immunosuppression in Honeybee Queens by the Neonicotinoids Thiacloprid and Clothianidin	colony neonicotinoid demonstrate queens affect immunocompetence effects pesticides survival 
2017-12-01	Virus and dsRNA-triggered transcriptional responses reveal key components of honey bee antiviral defense	virus antiviral expression genes well associated including role responses 
2017-12-01	Larval honey bees infected with Nosema ceranae have increased vitellogenin titers as young adults	adult levels elevated significantly infection colony old associated larval 
2017-12-01	Single-stranded RNA viruses infecting the invasive Argentine ant, Linepithema humile	virus viruses confirmed ants presence known novel invasive examined 
2017-12-01	Invasive plants as potential food resource for native pollinators: A case study with two invasive species and a generalist bumble bee	invasive plant pollen foraging acid nutritional behaviour behavioural amino 
2017-12-01	Colony adaptive response to simulated heat waves and consequences at the individual level in honeybees (Apis mellifera)	heat individual colony foraging observed activity increase levels recruitment 
2017-12-01	Neonicotinoid-induced pathogen susceptibility is mitigated by Lactobacillus plantarum immune stimulation in a Drosophila melanogaster model	melanogaster exposure survival bacterial heat toxicity neonicotinoid population insecticides 
2017-12-01	Sublethal Effects of the Neonicotinoid Insecticide Thiamethoxam on the Transcriptome of the Honey Bees (Hymenoptera: Apidae)	insecticides widely including thiamethoxam molecular drug showed immunocompetence pathway 
2017-12-01	Partitioning the roles of CYP6G1 and gut microbes in the metabolism of the insecticide imidacloprid in Drosophila melanogaster	metabolites gene metabolism oxidative question shown within produced metabolic 
2017-12-01	Honey bee pathogens in Ghana and the presence of contaminated beeswax	destructor molecular populations survey chlorpyrifos sampled tumida monitoring fluvalinate 
2017-12-01	The pesticide flupyradifurone impairs olfactory learning in Asian honey bees (Apis cerana) exposed as larvae or as adults	dose effects doses lower learning average olfactory resulted adult 
2017-12-01	The challenges of predicting pesticide exposure of honey bees at landscape level	pesticides crops exposure late pesticide evaluate boscalid able dimethoate 
2017-12-01	Honey bees dance faster for pollen that complements colony essential fatty acid deficiency	pollen foragers colony greater balance colonies pollens rates fatty 
2017-12-01	Vegetation Management and Host Density Influence Bee-Parasite Interactions in Urban Gardens	phorid bumble parasitism urban local landscape host increased mellifera 
2017-12-01	ATP-sensitive inwardly rectifying potassium channel regulation of viral infections in honey bees	antiviral immune virus response viruses infection viral model increases 
2017-12-01	Local ecological knowledge reveals effects of policy-driven land use and cover change on beekeepers in Costa Rica	change outcomes land economic study establishment ecosystem policies including 
2017-12-01	A real-time PCR method for quantification of the total and major variant strains of the deformed wing virus	virus total real chain specific samples method time varying 
2017-12-01	Field-relevant doses of the systemic insecticide fipronil and fungicide pyraclostrobin impair mandibular and hypopharyngeal glands in nurse honeybees (Apis mellifera)	glands nurse hypopharyngeal colony pesticide doses fipronil number treatment 
2017-12-01	Do managed bees have negative effects on wild bees?: A systematic review of the literature	effects managed wild studies negative reported native potential topical 
2017-12-01	Nosema ceranae, Fipronil and their combination compromise honey bee reproduction via changes in male physiology	combination effects semen physiology drones induced poor exposure might 
2017-12-01	The heat shock response and humoral immune response are mutually antagonistic in honey bees	network shock abdomen understanding immune found results multiple cellular 
2017-12-01	Protein nutrition governs within-host race of honey bee pathogens	ceranae infected spore virus nutrition without also negative reduced 
2017-12-01	Bees of Maine, with a State Species Checklist	species since records number future county list increase led 
2017-11-29	Landscape predictors of pathogen prevalence and range contractions in US bumblebees	contractions pathogen declining prevalence conservation found usage fungicide greater 
2017-11-15	Monitoring colony-level effects of sublethal pesticide exposure on honey bees	hive internal effects hives methods detect low average measure 
2017-11-01	Diagnosis and distribution of the Apis mellifera filamentous virus (AmFV) in honey bees (Apis mellifera) in China	infection presence geographical prevalence cerana significantly colonies mellifera distribution 
2017-11-01	Dietary amino acid and vitamin complex protects honey bee from immunosuppression caused by Nosema ceranae	amino vitamin peptides ceranae day expression negative post complex 
2017-11-01	Complete mitochondrial genome sequence of Aethina tumida (Coleoptera: Nitidulidae), a beekeeping pest	protein sequence mitochondrial genetic pest gene species et insect 
2017-11-01	Chemical and cultural control of Tropilaelaps mercedesae mites in honeybee (Apis mellifera) colonies in Northern Thailand	control mite pest reduced may colony parent cultural globally 
2017-11-01	Toward functional pollinator abundance and diversity: Comparing policy response for neonicotinoid use to demonstrate a need for cautious and well-planned policy	policy conservation pollinator findings neonicotinoid research ecosystem use response 
2017-11-01	The discovery of halictivirus resolves the sinaivirus phylogeny	virus new viral viruses ant four genus ants clades 
2017-11-01	Acute toxicity of five pesticides to Apis mellifera larvae reared in vitro	larvae pesticides exposure toxicity pesticide larva values h rearing 
2017-11-01	ABC assay: Method development and application to quantify the role of three DWV master variants in overwinter colony losses of European honey bees	master variants assay set chain polymerase primer allow variant 
2017-11-01	Hemolectin expression reveals functional heterogeneity in honey bee (Apis mellifera) hemocytes	protein blood mellifera cell hemocytes molecular markers functional hemocyte 
2017-11-01	Review of IoT applications in agro-industrial and environmental fields	environmental literature communication visualization review application using computing selected 
2017-11-01	Thiamethoxam and picoxystrobin reduce the survival and overload the hepato-nephrocitic system of the Africanized honeybee	pesticides body exposure fat effects induced pollen attempt hemocyte 
2017-10-20	Varroa sensitive hygiene contributes to naturally selected varroa resistance in honey bees	resistance varroa colonies control resistant populations conclude development one 
2017-10-20	Agricultural pesticide residues in honey and wax combs from Southeastern, Central and Northeastern Mexico	wax pesticides found residues main agrochemicals hive samples levels 
2017-10-20	The composition of bee pollen color fractions evaluated by solid-state<sup>1</sup>H and<sup>13</sup>C NMR: their macroelement content and antioxidant properties	pollen amounts spectra antioxidant samples higher rapeseed different content 
2017-10-20	Oral administration of essential oils and main components: Study on honey bee survival and Nosema ceranae development	different survival substances effect sublethal evaluated administered microsporidian emerged 
2017-10-09	Empirical, metagenomic, and computational techniques illuminate the mechanisms by which fungicides compromise bee health	fungicides colony fungicide pollen microbial bumble microbiome experiments evidence 
2017-10-03	Metabolism of N-Methyl-2-Pyrrolidone in Honey Bee Adults and Larvae: Exploring Age Related Differences in Toxic Effects	cytochrome larvae enzyme chronic activity difference adults may higher 
2017-10-03	Quantitative weight of evidence assessment of higher-tier studies on the toxicity and risks of neonicotinoid insecticides in honeybees 1: Methods	studies quality analyses field relevance exposures literature papers quantitative 
2017-10-03	Quantitative weight of evidence assessment of higher-tier studies on the toxicity and risks of neonicotinoids in honeybees. 2. Imidacloprid	risk studies seed used weight quantitative evidence via overall 
2017-10-03	Quantitative weight of evidence assessment of higher tier studies on the toxicity and risks of neonicotinoids in honeybees. 4. Thiamethoxam	via effects risk exposures studies overall evidence field adverse 
2017-10-01	Field Residues and Effects of the Insect Growth Regulator Novaluron and Its Major Co-Formulant N -Methyl-2-Pyrrolidone on Honey Bee Reproduction and Development	found studies ppm laboratory low concentrations study doses average 
2017-10-01	Amitraz and its metabolite modulate honey bee cardiac function and tolerance to viral infection	viral amitraz cardiac effects metabolite interaction acaricide impact use 
2017-10-01	Effects of diluents and plasma on honey bee (Apis mellifera L.) drone frozen-thawed semen fertility	fresh semen brood addition treatment control following groups worker 
2017-10-01	Immune related gene expression in worker honey bee (Apis mellifera carnica) pupae exposed to neonicotinoid thiamethoxam and Varroa mites (Varroa destructor)	pupae immune thiamethoxam gene effects genes expression destructor parasite 
2017-10-01	Revealing Pesticide Residues under High Pesticide Stress in Taiwan's Agricultural Environment Probed by Fresh Honey Bee (Hymenoptera: Apidae) Pollen	pollen pesticide samples problems pesticides residues suffered contaminated government 
2017-10-01	Neonicotinoid pesticides can reduce honeybee colony genetic diversity	queens genetic colony worker number mating colonies may effect 
2017-10-01	Relative abundance of deformed wing virus, Varroa destructor virus 1, and their recombinants in honey bees (Apis mellifera) assessed by kmer analysis of public RNA-Seq data	recombinant relative virus consistent highlight virulence local monitor disrupt 
2017-10-01	Nectar and Pollen Phytochemicals Stimulate Honey Bee (Hymenoptera: Apidae) Immunity to Viral Infection	phytochemicals infection phytochemical consumption virus outside seven reduced colony 
2017-09-15	The silent beehive: How the decline of honey bee populations shifted the environmental protection agency's pesticide policy towards pollinators	new guidelines emerged pesticides continue began risk even pesticide 
2017-09-07	5 key challenges and solutions for governing complex adaptive (food) systems	agricultural food adaptive systems governance production characteristics land water 
2017-09-01	Honey bee-collected pollen in agro-ecosystems reveals diet diversity, diet quality, and pesticide exposure	blueberry apple diet pollen cranberry fallow low pesticides sites 
2017-09-01	Dietary supplementation of honey bee larvae with arginine and abscisic acid enhances nitric oxide and granulocyte immune responses after trauma	immune response affecting activation enhanced vitro biotic defenses supporting 
2017-09-01	Coumaphos residues in honey, bee brood, and beeswax after Varroa treatment	coumaphos beeswax accumulation hives used indicate brood nearby extraction 
2017-09-01	Internal hive temperature as a means of monitoring honey bee colony health in a migratory beekeeping operation before and during winter	temperature hives commercial brood kept temperatures colony well exposed 
2017-09-01	Toxicity of organophosphorus pesticides to the stingless bees Scaptotrigona bipunctata and Tetragonisca fiebrigi	chlorpyrifos insecticides phosmet stingless differences study tested toxicity susceptibility 
2017-09-01	Ecological and evolutionary approaches to managing honeybee disease\	disease including factors dynamics evolutionary ecological management addressing principles 
2017-08-22	Characterization of the copy number and variants of Deformed Wing Virus (DWV) in the pairs of honey bee pupa and infesting varroa destructor or Tropilaelaps mercedesae	number copy virus pupae mites viral variant destructor chain 
2017-08-08	Thiacloprid alters social interactions among honey bee workers (Apis mellifera)	thiacloprid food network worker may social group effects sublethal 
2017-08-08	Effect of oxalic acid on the mite Varroa destructor and its host the honey bee Apis mellifera	oxalic acid mites treated effect varroa midgut isolated study 
