2016-06-15	Why do Varroa mites prefer nurse bees?	mites host mite nurses preference show adapted biology human 
2016-06-01	B+WSN: Smart beehive with preliminary decision tree analysis for agriculture and honey bee health monitoring	data algorithm classification sensor beehive important parameters biological based 
2016-06-01	Sucrose sensitivity of honey bees is differently affected by dietary protein and a neonicotinoid pesticide	protein sucrose colony food dietary effects survival thiamethoxam carbohydrate 
2016-06-01	Specific immune stimulation by endogenous bacteria in honey bees (Hymenoptera: Apidae)	bacteria immune immunomodulatory potential endogenous strains environmental development associated 
2016-06-01	Sperm viability and gene expression in honey bee queens (Apis mellifera) following exposure to the neonicotinoid insecticide imidacloprid and the organophosphate acaricide coumaphos	expression doses viability genes queens compounds coumaphos day sperm 
2016-06-01	Selective Behaviour of Honeybees in Acquiring European Propolis Plant Precursors	resins bud antimicrobial black chemical propolis behavior composition markers 
2016-06-01	Honeybees produce millimolar concentrations of non-neuronal acetylcholine for breeding: Possible adverse effects of neonicotinoids	brood food larval neonicotinoids gland concentrations content jelly clothianidin 
2016-06-01	Varroa destructor and viruses association in honey bee colonies under different climatic conditions	colonies climate subtropical treatment virus infestation received temperate able 
2016-06-01	Isoform-specific modulation of the chemical sensitivity of conserved TRPA1 channel in the major honeybee ectoparasitic mite, Tropilaelaps mercedesae	mercedesae channel one two activated chemical ectoparasitic compounds potential 
2016-06-01	Rapid and Reliable Method for Analyzing Acaricides in Honey-Based Products	analytical solution products range standard limits method affects vary 
2016-06-01	Food for pollinators: Quantifying the nectar and pollen resources of urban flower meadows	pollen seed resource mixes species flower per produced resources 
2016-05-31	Non-cultivated plants present a season-long route of pesticide exposure for honey bees	pollen foraging neonicotinoid pollution pollinator levels pyrethroid exposure plants 
2016-05-07	MelissAR: Towards augmented visual analytics of honey bee behaviour	based effective support system reality relevant design implementation behaviour 
2016-05-01	The status of honey bee health in Italy: Results from the nationwide bee monitoring network	colony health mortality hive samples land paralysis losses second 
2016-05-01	Weakness and collapse of bee colonies in Brazil: Are there cases of CCD?	collapse studies mainly pesticides associated pathogens causes possible recorded 
2016-05-01	Chronic toxicity and physiological changes induced in the honey bee by the exposure to fipronil and Bacillus thuringiensis spores alone or combined	physiological enzyme effects bacterial phosphate spores glucose strain days 
2016-05-01	Acute exposure to selenium disrupts associative conditioning and long-term memory recall in honey bees (Apis mellifera)	selenium sublethal exposure memory conditioning learning form ability recall 
2016-05-01	A toolbox for quantitative gene expression in varroa destructor: RNA degradation in field samples and systematic analysis of reference gene stability	genes gene expression stable chain reference studies high quality 
2016-05-01	Natural Varroa mite-surviving Apis mellifera honeybee populations	populations mite destructor survival wild world documented threat pest 
2016-05-01	Disease dynamics of honeybees with Varroa destructor as parasite and virus vector	virus mites effects parasitic infections brood adult mathematical reproductive 
2016-05-01	Multiyear survey targeting disease incidence in US honey bees	disease loads paralysis destructor positive prevalence across virus sampled 
2016-05-01	Modulation of pesticide response in honeybees	environmental health conditions factors pesticide response physiological assessment variability 
2018-02-15	A 3-year survey of Italian honey bee-collected pollen reveals widespread contamination by agricultural pesticides	pesticide survey samples environmental pesticides positive apiaries pollen dietary 
2018-02-14	Study of the metatranscriptome of eight social and solitary wild bee species reveals novel viruses and bee parasites	viruses species including virus wild associated solitary stranded high 
2018-02-08	Short-Term Exposure to Lambda-Cyhalothrin Negatively Affects the Survival and Memory-Related Characteristics of Worker Bees Apis mellifera	
2018-02-08	Effects of neonicotinoid imidacloprid exposure on bumble bee (Hymenoptera: Apidae) queen survival and nest initiation	queen nest bumble may imidacloprid exposure risk queens show 
2018-02-01	The immunological dependence of plant-feeding animals on their host’s medical properties may explain part of honey bee colony losses	properties plants declines dependence secondary plant may also medicinal 
2018-02-01	Nosema ceranae disease of the honey bee (Apis mellifera)	ceranae pathology observations research thought individual well effects health 
2018-02-01	Specialty oilseed crops provide an abundant source of pollen for pollinators and beneficial insects	oilseed pollen crops beneficial production mays alternative officinalis cuphea 
2018-02-01	Reproduction of parasitic mites Varroa destructor in original and new honeybee hosts	host mite reproduction original lack due infestations brood hosts 
2018-02-01	Characterization of gut bacterial flora of Apis mellifera from north-west Pakistan	gut beneficial bacteria bacterial isolates microbiota study healthy play 
2018-02-01	Stress decreases pollen foraging performance in honeybees	foraging pollen behaviour higher nectar metabolic reduced flight also 
2018-02-01	From field to food—will pesticide-contaminated pollen diet lead to a contamination of royal jelly?	used pesticides low queen contamination fed concentrations nurse commonly 
2018-02-01	Genomes of the Hymenoptera	genomes needed sequencing assembly progress least genome represent sequenced 
2018-01-15	Classical and geometric morphometric methods reveal differences between specimens of Varroa destructor (Mesostigmata: Varroidae) from seven provinces of Iran	morphometric geometric used specimens analysis length difference including located 
2018-01-07	Nutritional Physiology and Ecology of Honey Bees	colony food pollen also proportions growing shows rights specific 
2018-01-02	Determining the minimum number of pollen grains needed for accurate honey bee (Apis mellifera) colony pollen pellet analysis	pollen taxa taxonomic floral three number standards grains plant 
2018-01-01	Using colony monitoring devices to evaluate the impacts of land use and nutritional value of forage on honey bee health	colony growing pollen health two weight scales used devices 
2018-01-01	Lactobacillus kunkeei strains decreased the infection by honey bee pathogens Paenibacillus larvae and Nosema ceranae	larvae infected effect ceranae adult improve mixture beneficial prevention 
2018-01-01	Lethal effects of Cr(III) alone and in combination with propiconazole and clothianidin in honey bees	heavy propiconazole antagonistic anthropogenic toxicity mellifera combination slight though 
2018-01-01	Epormenis cestri secretions in Sebastiania schottiana trees cause mass death of honey bee Apis mellifera larvae in Uruguay	nectar larvae mortality secretions affected abundant larval located healthy 
2018-01-01	The impact of selected pesticides on honey bees	plant elements pesticides protection survival tested selected impact trace 
2018-01-01	Primary data in pollination services mapping: potential service provision by honey bees (Apis mellifera) in Cumberland and Colchester, Nova Scotia	ecosystem data model mapping field services pollination utilized different 
2018-01-01	Honey yield of different commercial apiaries treated with Lactobacillus salivarius A3iob, a new bee-probiotic strain	hives treated higher main yield impact fed without groups 
2018-01-01	Honey bee (Apis mellifera) nurses do not consume pollens based on their nutritional quality	pollens nutritional nurses protein pollen prefer diets different three 
2018-01-01	Mitigating effects of pollen during paraquat exposure on gene expression and pathogen prevalence in Apis mellifera L	paraquat oxidative pollen mitigating gene especially expression genes reported 
2018-01-01	Effect of pollen extract supplementation on the varroatosis tolerance of honey bee (Apis mellifera) larvae reared in vitro	pollen tolerance larval weight effect loss development physiological laboratory 
2018-01-01	The first report of the prevalence of Nosema ceranae in Bulgaria	ceranae apis country main species samples dominant results chain 
2018-01-01	Decline of bumble bees in northeastern North America, with special focus on Bombus terricola	conservation species population may decline regions records severe found 
2018-01-01	Comparative chronic toxicity of three neonicotinoids on New Zealand packaged honey bees	weight size area population environmental detect neonicotinoids exposure colony 
2018-01-01	Impact of beneficial bacteria supplementation on the gut microbiota, colony development and productivity of Apis mellifera L.	gut generation microbiota investigated hives pollen increase brood field 
2018-01-01	COREMIC: A web-tool to search for a niche associated CORE MICrobiome	used across core related using available taxa case growth 
2018-01-01	The impact of restrictions on neonicotinoid and fipronil insecticides on pest management in maize, oilseed rape and sunflower in eight European Union regions	seed case farmers treatments pest management restricted growing use 
2018-01-01	Metabolisation of thiamethoxam (a neonicotinoid pesticide) and interaction with the Chronic bee paralysis virus in honeybees	viral thiamethoxam increase dose virus exposed synergistic show exposure 
2018-01-01	Bacterial communities associated with the ectoparasitic mites Varroa destructor and Tropilaelaps mercedesae of the honey bee (Apis mellifera)	mites bacteria bacterial obtained taxonomic operational using genus destructor 
2018-01-01	Increased survival of honeybees in the laboratory after simultaneous exposure to low doses of pesticides and bacteria	exposed thiacloprid survival effects insecticide decreased agents exposure physiological 
2017-12-20	Neonicotinoid pesticides and nutritional stress synergistically reduce survival in honey bees	pesticide stress nectar health synergistically food risk haemolymph nutritional 
2017-12-15	Occurrence of pesticide residues in Spanish beeswax	pesticide old pesticides combs contaminated beeswax mass applied used 
2017-12-12	Presence of Apis rhabdovirus-1 in populations of pollinators and their parasites from two continents	virus destructor mellifera mites presence found viruses shared impatiens 
2017-12-01	Comparative flight activities and pathogen load of two stocks of honey bees reared in gamma-irradiated combs	combs reared foraging irradiation flight impact may stocks pollen 
2017-12-01	Behavioral responses of honey bees (Apis mellifera) to natural and synthetic xenobiotics in food	pesticides preference health may five floral risk frequency phytochemicals 
2017-12-01	Elucidating the mechanisms underlying the beneficial health effects of dietary pollen on honey bees (Apis mellifera) infested by Varroa mite ectoparasites	pollen effects observed colony mite resins parasitic deleterious transcriptomic 
2017-12-01	Recent spread of Varroa destructor virus-1, a honey bee pathogen, in the United States	virus present colony tested rates viruses generation next colonies 
2017-12-01	A Varroa destructor protein atlas reveals molecular underpinnings of developmental transitions and sexual differentiation	protein developmental proteins differentially sex foundress feature quantitation tool 
2017-12-01	Peptide biomarkers used for the selective breeding of a complex polygenic trait in honey bees	markers using breeding livestock stock select protein hygienic expression 
2017-12-01	An abbreviated SNP panel for ancestry assignment of honeybees (Apis mellifera)	semen single countries genetic mixed find important contributing therefore 
2017-12-01	Apitoxin harvest impairs hypopharyngeal gland structure in Apis mellifera honey bees	subjected ten treatment hives harvest harvesting number hypopharyngeal area 
2017-12-01	Temporal dynamics of whole body residues of the neonicotinoid insecticide imidacloprid in live or dead honeybees	residues samples light decrease exposure imidacloprid significantly acute reduced 
2017-12-01	Chemical characterization and acaricidal activity of Thymus satureioides C. &amp; B. and Origanum elongatum E. &amp; M. (Lamiaceae) essential oils against Varroa destructor Anderson &amp; Trueman (Acari: Varroidae)	carvacrol satureioides composition essential activity foraging chemical effect growth 
2017-12-01	Efficacy of extracts from eight economically important forestry species against grapevine downy mildew (Plasmopara viticola) and identification of active constituents	pathogen extracts compounds species active low activity eight acetate 
2017-12-01	Immunosuppression in Honeybee Queens by the Neonicotinoids Thiacloprid and Clothianidin	colony affect demonstrate immunocompetence neonicotinoid queens antimicrobial insecticides clothianidin 
2017-12-01	Virus and dsRNA-triggered transcriptional responses reveal key components of honey bee antiviral defense	antiviral virus utilized expression well genes responses role associated 
2017-12-01	Larval honey bees infected with Nosema ceranae have increased vitellogenin titers as young adults	adult significantly infection levels elevated colony workers ceranae associated 
2017-12-01	Single-stranded RNA viruses infecting the invasive Argentine ant, Linepithema humile	virus viruses confirmed host presence potential novel examined ant 
2017-12-01	Invasive plants as potential food resource for native pollinators: A case study with two invasive species and a generalist bumble bee	pollen plant foraging invasive acid nutritional amino differences intake 
2017-12-01	Colony adaptive response to simulated heat waves and consequences at the individual level in honeybees (Apis mellifera)	individual colony foraging heat observed levels recruitment activity increase 
2017-12-01	Neonicotinoid-induced pathogen susceptibility is mitigated by Lactobacillus plantarum immune stimulation in a Drosophila melanogaster model	melanogaster survival exposure bacterial heat toxicity neonicotinoid findings pesticides 
2017-12-01	Sublethal Effects of the Neonicotinoid Insecticide Thiamethoxam on the Transcriptome of the Honey Bees (Hymenoptera: Apidae)	insecticides neonicotinoid analysis including widely studies thiamethoxam showed molecular 
2017-12-01	Partitioning the roles of CYP6G1 and gut microbes in the metabolism of the insecticide imidacloprid in Drosophila melanogaster	metabolites gene shown metabolism question metabolic within produced oxidative 
2017-12-01	Honey bee pathogens in Ghana and the presence of contaminated beeswax	molecular destructor populations survey haplotype signs tumida trypanosomatids corresponding 
2017-12-01	The pesticide flupyradifurone impairs olfactory learning in Asian honey bees (Apis cerana) exposed as larvae or as adults	dose effects doses lower learning tested resulted adult average 
2017-12-01	The challenges of predicting pesticide exposure of honey bees at landscape level	pesticides crops exposure boscalid late able dimethoate evaluate pesticide 
2017-12-01	Honey bees dance faster for pollen that complements colony essential fatty acid deficiency	pollen foragers rates novel rich colony two colonies greater 
2017-12-01	Vegetation Management and Host Density Influence Bee-Parasite Interactions in Urban Gardens	phorid bumble parasitism local urban host reported land parasite 
2017-12-01	ATP-sensitive inwardly rectifying potassium channel regulation of viral infections in honey bees	antiviral response viruses immune viral important infection virus channel 
2017-12-01	Local ecological knowledge reveals effects of policy-driven land use and cover change on beekeepers in Costa Rica	change conservation outcomes study establishment economic land ecosystem provides 
2017-12-01	A real-time PCR method for quantification of the total and major variant strains of the deformed wing virus	virus total polymerase specific chain wing deformed real varying 
2017-12-01	Field-relevant doses of the systemic insecticide fipronil and fungicide pyraclostrobin impair mandibular and hypopharyngeal glands in nurse honeybees (Apis mellifera)	glands colony nurse pesticide hypopharyngeal doses number secretion pyraclostrobin 
2017-12-01	Do managed bees have negative effects on wild bees?: A systematic review of the literature	effects managed wild studies negative reported native potential plant 
2017-12-01	Nosema ceranae, Fipronil and their combination compromise honey bee reproduction via changes in male physiology	effects combination physiology drones semen drone induced poor synergistic 
2017-12-01	The heat shock response and humoral immune response are mutually antagonistic in honey bees	abdomen increased shock responses network genes stress understanding heat 
2017-12-01	Protein nutrition governs within-host race of honey bee pathogens	ceranae virus infected spore role also nutrition reduced without 
2017-12-01	Bees of Maine, with a State Species Checklist	species records since provide developed followed genera studied increase 
2017-11-29	Landscape predictors of pathogen prevalence and range contractions in US bumblebees	prevalence found contractions range species pathogen fungicide greater declining 
2017-11-15	Monitoring colony-level effects of sublethal pesticide exposure on honey bees	hive hives effects methods internal detect syrup weight colonies 
2017-11-01	Diagnosis and distribution of the Apis mellifera filamentous virus (AmFV) in honey bees (Apis mellifera) in China	presence infection geographical prevalence cerana colonies virus occurred mellifera 
2017-11-01	Dietary amino acid and vitamin complex protects honey bee from immunosuppression caused by Nosema ceranae	vitamin amino day ceranae expression peptides genes compared post 
2017-11-01	Complete mitochondrial genome sequence of Aethina tumida (Coleoptera: Nitidulidae), a beekeeping pest	protein sequence mitochondrial genetic pest gene species introduced controlled 
2017-11-01	Chemical and cultural control of Tropilaelaps mercedesae mites in honeybee (Apis mellifera) colonies in Northern Thailand	control mite colony pest population may used significantly reduced 
2017-11-01	Toward functional pollinator abundance and diversity: Comparing policy response for neonicotinoid use to demonstrate a need for cautious and well-planned policy	policy neonicotinoid conservation findings research pollinator response use articles 
2017-11-01	The discovery of halictivirus resolves the sinaivirus phylogeny	four virus ant new genus clades viral viruses likelihood 
2017-11-01	Acute toxicity of five pesticides to Apis mellifera larvae reared in vitro	larvae pesticides exposure toxicity pesticide larva h values rearing 
2017-11-01	ABC assay: Method development and application to quantify the role of three DWV master variants in overwinter colony losses of European honey bees	master set variants assay chain polymerase variant primer whether 
2017-11-01	Hemolectin expression reveals functional heterogeneity in honey bee (Apis mellifera) hemocytes	protein blood cell mellifera hemocytes molecular functional markers identification 
2017-11-01	Review of IoT applications in agro-industrial and environmental fields	literature environmental communication visualization application review using information published 
2017-11-01	Thiamethoxam and picoxystrobin reduce the survival and overload the hepato-nephrocitic system of the Africanized honeybee	pesticides effects exposure body concentrations induced sublethal fat pollen 
2017-10-20	Varroa sensitive hygiene contributes to naturally selected varroa resistance in honey bees	colonies varroa resistance control mites populations resistant development mite 
2017-10-20	Agricultural pesticide residues in honey and wax combs from Southeastern, Central and Northeastern Mexico	pesticides found wax residues main colony pesticide samples agrochemicals 
2017-10-20	The composition of bee pollen color fractions evaluated by solid-state<sup>1</sup>H and<sup>13</sup>C NMR: their macroelement content and antioxidant properties	pollen rapeseed antioxidant samples higher amounts spectra hives substances 
2017-10-20	Oral administration of essential oils and main components: Study on honey bee survival and Nosema ceranae development	different survival substances sublethal resulting prolonged productivity oral studied 
2017-10-09	Empirical, metagenomic, and computational techniques illuminate the mechanisms by which fungicides compromise bee health	fungicides colony pollen fungicide indirect causing microbiome experiments evidence 
2017-10-03	Metabolism of N-Methyl-2-Pyrrolidone in Honey Bee Adults and Larvae: Exploring Age Related Differences in Toxic Effects	cytochrome larvae enzyme difference activity percentage adults chronic higher 
2017-10-03	Quantitative weight of evidence assessment of higher-tier studies on the toxicity and risks of neonicotinoid insecticides in honeybees 1: Methods	studies quality conducted field analyses exposures three provided relevance 
2017-10-03	Quantitative weight of evidence assessment of higher-tier studies on the toxicity and risks of neonicotinoids in honeybees. 2. Imidacloprid	risk studies seed used weight exposure via effects quantitative 
2017-10-03	Quantitative weight of evidence assessment of higher tier studies on the toxicity and risks of neonicotinoids in honeybees. 4. Thiamethoxam	via risk effects studies exposures adverse environmental level exposure 
2017-10-01	Field Residues and Effects of the Insect Growth Regulator Novaluron and Its Major Co-Formulant N -Methyl-2-Pyrrolidone on Honey Bee Reproduction and Development	found ppm studies need doses laboratory study residue field 
2017-10-01	Amitraz and its metabolite modulate honey bee cardiac function and tolerance to viral infection	viral amitraz may metabolite mite effects study use acaricide 
2017-10-01	Effects of diluents and plasma on honey bee (Apis mellifera L.) drone frozen-thawed semen fertility	semen fresh brood control following groups treatment addition worker 
2017-10-01	Immune related gene expression in worker honey bee (Apis mellifera carnica) pupae exposed to neonicotinoid thiamethoxam and Varroa mites (Varroa destructor)	pupae immune gene expression genes thiamethoxam abaecin effects larval 
2017-10-01	Revealing Pesticide Residues under High Pesticide Stress in Taiwan's Agricultural Environment Probed by Fresh Honey Bee (Hymenoptera: Apidae) Pollen	pesticide pollen pesticides samples residues study higher problems contaminated 
2017-10-01	Neonicotinoid pesticides can reduce honeybee colony genetic diversity	queens genetic worker number mating colony neonicotinoids neonicotinoid stored 
2017-10-01	Relative abundance of deformed wing virus, Varroa destructor virus 1, and their recombinants in honey bees (Apis mellifera) assessed by kmer analysis of public RNA-Seq data	recombinant relative consistent virus concern reports identified indicated viral 
2017-10-01	Nectar and Pollen Phytochemicals Stimulate Honey Bee (Hymenoptera: Apidae) Immunity to Viral Infection	phytochemicals infection phytochemical consumption affect seven also colony pollinator 
2017-09-15	The silent beehive: How the decline of honey bee populations shifted the environmental protection agency's pesticide policy towards pollinators	new guidelines emerged pollinator pesticide pesticides even risk successfully 
2017-09-07	5 key challenges and solutions for governing complex adaptive (food) systems	agricultural adaptive governance systems food land characteristics production water 
2017-09-01	Honey bee-collected pollen in agro-ecosystems reveals diet diversity, diet quality, and pesticide exposure	blueberry diet apple fallow cranberry pollen sites low poor 
2017-09-01	Dietary supplementation of honey bee larvae with arginine and abscisic acid enhances nitric oxide and granulocyte immune responses after trauma	immune response fitness show contribute protect central roles humoral 
2017-09-01	Coumaphos residues in honey, bee brood, and beeswax after Varroa treatment	coumaphos beeswax accumulation hives used brood indicate observed detection 
2017-09-01	Internal hive temperature as a means of monitoring honey bee colony health in a migratory beekeeping operation before and during winter	temperature hives brood commercial kept well temperatures detected exposed 
2017-09-01	Toxicity of organophosphorus pesticides to the stingless bees Scaptotrigona bipunctata and Tetragonisca fiebrigi	chlorpyrifos tested insecticides stingless phosmet study significant toxicity showed 
2017-09-01	Ecological and evolutionary approaches to managing honeybee disease\	disease including factors ecological dynamics addressing principles management evolutionary 
2017-08-22	Characterization of the copy number and variants of Deformed Wing Virus (DWV) in the pairs of honey bee pupa and infesting varroa destructor or Tropilaelaps mercedesae	copy number pupae mercedesae virus mites immune variant role 
2017-08-08	Thiacloprid alters social interactions among honey bee workers (Apis mellifera)	worker thiacloprid food network may social effects group quantified 
2017-08-08	Effect of oxalic acid on the mite Varroa destructor and its host the honey bee Apis mellifera	oxalic acid mites treated effect varroa midgut decrease applied 
