2014-09-01	Determination of nonylphenol ethoxylate and octylphenol ethoxylate surfactants in beehive samples by high performance liquid chromatography coupled to mass spectrometry	pollen liquid method wax mass performance concentrations high proved 
2014-09-01	An inventory of documented diseases of african honeybees	information pathogens populations mites geographic changes exists substantial destructor 
2014-08-25	Assembly of recombinant israeli acute paralysis virus capsids	protein virus capsids structural recombinant many expression specific cell 
2014-08-21	On the Front Line: Quantitative Virus Dynamics in Honeybee (Apis mellifera L.) Colonies along a New Expansion Front of the Parasite Varroa destructor	virus titres viral infestation parasite mite annual dynamic spread 
2014-08-19	Potential exposure of pollinators to neonicotinoid insecticides from the use of insecticide seed treatments in the mid-southern United States	neonicotinoid seed pollen insecticides soil insecticide concentrations levels samples 
2014-08-15	Parasite pressures on feral honey bees (Apis mellifera sp.)	feral managed colonies colony virus wing pests using pathogen 
2014-08-01	Impact of chronic neonicotinoid exposure on honeybee colony performance and queen supersedure	colony neonicotinoid fully queen exposure colonies genetic performance experimental 
2014-08-01	Risk factors associated with the presence of Varroa destructor in honey bee colonies from east-central Argentina	mite management destructor risk beekeepers infestation associated colonies feeding 
2014-08-01	Pesticides, food safety and integrated pest management	food pest human population pesticide pesticides negative land integrated 
2014-07-21	Honeybee colony disorder in crop areas: The role of pesticides and viruses	colony colonies virus disorders queen brood observed significant load 
2014-07-17	Diet-dependent gene expression in honey bees: Honey vs. sucrose or high fructose corn syrup	expression involved gene genes sources alternative differences nutritional carbohydrate 
2014-07-14	Overview of Protection Goals for Pollinators	risk assessment use goal level pollination certain services general 
2014-07-14	Assessing Exposure of Pesticides to Bees	exposure pesticide assessments discusses chapter used employed oral component 
2014-07-04	Delayed and time-cumulative toxicity of imidacloprid in bees, ants and termites	t toxicity imidazole nitro toxic imidacloprid curves plots fit 
2014-07-03	Reviews of science for science librarians: An update on Honeybee Colony Collapse Disorder	literature presence higher articles despite factors still significance effects 
2014-07-01	Pesticide residues in honeybees, honey and bee pollen by LC-MS/MS screening: Reported death incidents in honeybees	values pollen ranging method presence cases samples matrices matrix 
2014-06-23	Honey bee Apis mellifera parasites in the absence of Nosema ceranae fungi and Varroa destructor mites	colonies parasites cell queen black absence free ceranae mites 
2014-06-13	Increased tolerance and resistance to virus infections: A possible factor in the survival of Varroa destructor-resistant honey bees (Apis mellifera)	virus population resistance colony mite titres survived autumn colonies 
2014-06-11	Mapping large-area landscape suitability for honey bees to assess the influence of land-use change on sustainability of national pollination services	environmental land landscape scenario drivers suitability maps products pollination 
2014-06-03	Propolis chemical composition and honeybee resistance against Varroa destructor	chemical propolis composition tolerant colonies relationship results apiary colony 
2014-05-30	Identifying suitable queen rearing sites of Apis mellifera mellifera at a regional scale using morphometrics	mellifera colonies breeding ligustica hybridization mean subspecies suggests index 
2014-05-30	The influence of genetic origin and its interaction with environmental effects on the survival of Apis Mellifera L. Colonies in Europe	colonies environmental local survived origin survival days support prevent 
2014-05-30	Occurrence of parasites and pathogens in honey bee colonies used in a European genotypeenvironment Interactions experimentrs 2010/2011 and 2011/2012	colonies colony experiment occurrence virus deformed destructor mite one 
2014-05-13	Environmental fate of soil applied neonicotinoid insecticides in an irrigated potato agroecosystem	neonicotinoid water irrigation crop insecticides application mass neonicotinoids harvest 
2014-05-05	Dynamics of the presence of israeli acute paralysis virus in honey bee colonies with colony collapse disorder	colonies virus infectious recovered actively healthy health found viral 
2014-04-30	QuEChERS-based method for the multiresidue analysis of pesticides in beeswax by LC-MS/MS and GC×GC-TOF	phase solid pesticide procedure mass wax residues dispersive amine 
2014-04-17	A draft genome of the honey bee trypanosomatid parasite crithidia mellificae	mellificae species genetic draft carbohydrate genes increased pathogen losses 
2014-04-16	Evaluation of the distribution and impacts of parasites, pathogens, and pesticides on honey bee (apis mellifera) populations in east Africa	environmental correlated parasite factors positively colony three hygienic survival 
2014-04-16	The bacterial communities associated with honey bee (apis mellifera) foragers	pollen crop corbicular bacteria microbial core found acid food 
2014-04-09	Pesticide residues and bees - A risk assessment	risk residue assessments toxicity risks inhibiting contaminated pollen exposure 
2014-04-01	Esterases of Varroa destructor (Acari: Varroidae), parasitic mite of the honeybee	activity enzymes esterases phosphatase role resistance present higher exogenous 
2014-03-27	Cephalaria transsylvanica-based flower strips as potential food source for bees during dry periods in European Mediterranean basin countries	plant transsylvanica pollinators strips pollen terms showed food paucity 
2014-03-19	Transcriptome analyses of the honeybee response to Nosema ceranae and insecticides	expression gene insecticides combination induced lead impact higher ceranae 
2014-03-10	Expression of varroa sensitive hygiene (VSH) in iranian honey bees (Apis mellifera meda)	selection infestation rich offers sources genetic mite mites brood 
2014-03-07	Xenobiotic effects on intestinal stem cell proliferation in adult honey bee (Apis mellifera L) workers	stem xenobiotics intestinal cell animal proliferation activity important compounds 
2014-03-01	Nosema ceranae and RNA viruses in European and Africanized honeybee colonies (Apis mellifera) in Uruguay	ceranae colonies virus races flowering larger causative limit aim 
2014-03-01	A Causal Analysis of Observed Declines in Managed Honey Bees (Apis mellifera)	causes candidate reduced analysis managed causal overwinter categorized relationship 
2014-03-01	Vespa velutina: A new invasive predator of honeybees in Europe	velutina impact species cycle limit life methods biology review 
2014-02-25	Honey bee-infecting plant virus with implications on honey bee colony health	virus tobacco plant losses findings annually discovery viruses adaptation 
2014-02-25	Critical issues facing New Zealand entomology	enhancing support invasive entomological knowledge areas current limiting entomology 
2014-02-21	Africanized honey bees (Apis mellifera) have low infestation levels of the mite Varroa destructor in different ecological regions in Mexico	colonies temperate infestation rates dry region genotype destructor mite 
2014-02-20	Effect of bodily fluids from honey bee (apis mellifera) larvae on growth and genome-wide transcriptional response of the causal agent of american foulbrood disease (Paenibacillus larvae)	fluids larval growth larvae responses sugar genetic bacterial body 
2014-01-31	The distribution of Aspergillus spp. opportunistic parasites in hives and their pathogenicity to honey bees	larvae flavus adult isolates fungi pathogenic studies worker pathogenicity 
2014-01-29	Interactions between fungi and bacteria influence microbial community structure in the Megachile rotundata larval gut	gut fungal drug antibiotic insect caused larval microbes growth 
2014-01-27	Pollen diet for in vitro rearing of africanized honey bee larvae, Apis mellifera (Hymenoptera: Apidae)	pollen larvae larval mixtures development receive two survival adults 
2014-01-08	Four common pesticides, their mixtures and a formulation solvent in the hive environment have high oral toxicity to honey bee larvae	larval chlorothalonil pesticide chemical pesticides tested larvae toxicity pollen 
2014-01-01	Israeli Acute Paralysis Virus: Epidemiology, Pathogenesis and Implications for Honey Bee Health	host limiting virus responses infection will indicates colony viruses 
2014-01-01	Honey bee health in apiaries in the Vale do Paraíba, São Paulo state, Southeastern Brazil	destructor period prevalence infestation pathogens brood adult presence ceranae 
2014-01-01	Immunogene and viral transcript dynamics during parasitic Varroa destructor mite infection of developing honey bee (Apis mellifera) pupae	immune mite expression genes wing destructor immunosuppression developing suggest 
2014-01-01	The architecture of the pollen hoarding syndrome in honey bees: Implications for understanding social evolution, behavioral syndromes, and selective breeding	genetic syndrome social hoarding pollen architecture trait evolution may 
2014-01-01	Thiacloprid-Nosema ceranae interactions in honey bees: Host survivorship but not parasite reproduction is dependent on pesticide dose	thiacloprid stressors parasite thiazine pyridine ubiquitous nearly highlight influence 
2014-01-01	Detection of spiroplasma melliferum in honey bee colonies in the US	melliferum colonies prevalence infections reported infection colony due results 
2014-01-01	Honey bee sociogenomics: A genome-scale perspective on bee social behavior and health	social insights new genomic behavior provided information expression gene 
2014-01-01	Correlating the pollens gathered by APIS Mellifera with the landscape features in Western France	features landscape gathered urban apiaries specific palynological pollen landscapes 
2014-01-01	A comparison of the activities of Greek and Turkish propolis against Paenibacillus larvae	antimicrobial propolis collected activities around different activity larvae samples 
2014-01-01	Insulin-like peptide response to nutritional input in honey bee workers	diet high fed carbohydrates also expression individual body homeostasis 
2014-01-01	Honey production of honey bee (Hymenoptera: Apidae) colonies with high and low Varroa destructor (Acari: Varroidae) infestation rates in eastern Canada	colonies mite significantly infestation rates yields fall group per 
2014-01-01	High Varroa mite abundance influences chemical profiles of worker bees and mite-host preferences	mite animal mites chemical abundance one colonies nurses colony 
2014-01-01	Prevention of honeybee diseases	hives diseases importance important prevent reduce techniques bottom destructor 
2014-01-01	Bee bread increases honeybee haemolymph protein and promote better survival despite of causing higher Nosema ceranae abundance in honeybees	protein parasite diet higher healthy levels effect natural induced 
2014-01-01	Remote beehive monitoring using acoustic signals	data ability colony sensor system use proven goals proposed 
2014-01-01	Draft genome of Chilean honeybee (Apis mellifera) gut strain Lactobacillus kunkeei MP2	genome sequence kunkeei et first total strain sequenced size 
2014-01-01	Evaluating exposure and potential effects on honeybee brood (Apis mellifera) development using glyphosate as an example	glyphosate realistic effects pollen residues observed larvae approach exposure 
2014-01-01	Biodegradation of imidacloprid in an open compost pile	aeruginosa degradation imidacloprid piles one conditions aerobic faster spontaneous 
2014-01-01	Paratransgenesis feasibility in the honeybee (Apis mellifera) using Fructobacillus fructosus commensal	lactis carbon lactic expressed fluorescent genetic tools protein acid 
2014-01-01	A survey of imidacloprid levels in water sources potentially frequented by honeybees (Apis mellifera) in the eastern USA	water limit sublethal rural environmental samples diverse habitat livestock 
2014-01-01	Mating disruption of the honeybee mite Varroa destructor under laboratory and field conditions	pheromone host spermatozoa females mites presence cell clearly female 
2014-01-01	Nutrition affects longevity and gene expression in honey bee (Apis mellifera) workers	workers pollen fed jelly gene genes royal six affected 
2014-01-01	Sub-lethal exposure to neonicotinoids impaired honey bees winterization before proceeding to colony collapse disorder	colonies control observed exposure six colony mechanisms almost summer 
2014-01-01	Detection of Aethina tumida Murray (Coleoptera: Nitidulidae.) in Italy: Outbreaks and early reaction measures	tumida infested zone surveillance apiaries according protection collection colonies 
2014-01-01	A national survey of managed honey bee 2012-2013 annual colony losses in the USA: Results from the Bee Informed Partnership	beekeepers loss mortality colonies commercial average losses colony winter 
2014-01-01	Identification of developmentally-specific kinotypes and mechanisms of Varroa mite resistance through whole-organism, kinome analysis of honeybee	peptide biomarkers global susceptibility protein breeding differential viral infestation 
2014-01-01	Comparsion of two multiresidue methods for pesticide determination in pollen	method better modified different conventional pesticide analysis pesticides residues 
2014-01-01	Trace Analysis of Seven Neonicotinoid Insecticides in Bee Pollen by Solid-Liquid Extraction and Liquid Chromatography Coupled to Electrospray Ionization Mass Spectrometry	pollen ionization method mass extraction two neonicotinoids corbicular fruit 
2014-01-01	A large-scale field study examining effects of exposure to clothianidin seed-treated canola on honey bee colony health development, and overwintering success	clothianidin exposure canola field control seed colony bloom low 
2014-01-01	High levels of genetic diversity in Nosema ceranae within Apis mellifera colonies	genetic ceranae haplotypes isolates heat host recent within protein 
2014-01-01	Following beekeeping: More-than-human practice in agrifood	among approach beekeeping paper contemporary yet social practice little 
2014-01-01	Risks of neonicotinoid insecticides to honeybees	nervous modified application colony low insect habitat press authors 
2014-01-01	Nosema ceranae DNA in honey bee haemolymph and honey bee mite Varroa destructor	mite destructor found ceranae microsporidia haemolymph tissues believed threats 
2014-01-01	A survey on some factors potentially affecting losses of managed honey bee colonies in Luxembourg over the winters 2010/2011 and 2011/2012	losses hive colony control colonies varroa winter type rates 
2014-01-01	Identification and abiotic stress response of a glutamine synthetase gene (AccGS) from the asiatic honeybee, apis cerana cerana (hymenoptera: Apidae)	stress gene environmental expression showed enzyme data assay polymerase 
2014-01-01	Contextualising pollination benefits: Effect of insecticide and fungicide use on fruit set and weight from bee pollination in lowbush blueberry	crop fruit two disease pest activity pollinator set insect 
2014-01-01	Graph theoretical modelling and analysis of fragile honey bee pollination network	pollination network mellifera environmental using foraging stress assess agent 
2014-01-01	Honeybee pathogens and their management	pathogens colony diseases increased current due role major focus 
2014-01-01	Slow bee paralysis virus and its transmission in honey bee pupae by varroa destructor	virus pupae mite infected ten acquisition five transmission using 
2014-01-01	Analysis of the RdRp, intergenic and structural polyprotein regions, and the complete genome sequence of Kashmir bee virus from infected honeybees (Apis mellifera) in Korea	virus reference genotypes complete paralysis phylogenetic highly shared genome 
2014-01-01	Honey bees, neonicotinoids and bee incident reports: The Canadian situation	incidents data suspected dust number reported neonicotinoid planting major 
2014-01-01	Cytotoxic effects of thiamethoxam in the midgut and malpighian tubules of Africanized Apis mellifera (Hymenoptera: Apidae)	insecticide thiamethoxam used crops effects study use exposed showed 
2014-01-01	Autumn invasion rates of varroa destructor (Mesostigmata: Varroidae) into honey bee (Hymenoptera: Apidae) colonies and the resulting increase in mite populations	colonies mites invasion population per colony average growth infested 
2014-01-01	Virulence and polar tube protein genetic diversity of Nosema ceranae (Microsporidia) field isolates from Northern and Southern Europe in honeybees (Apis mellifera iberiensis)	genetic isolates differences mature differentiation immature trend locus field 
2014-01-01	A comparative study of environmental conditions, Bee management and the epidemiological situation in apiaries varying in the level of colony losses	paralysis virus samples wing acute mortality deformed research project 
2014-01-01	Colliding with reality: Liquid modernity and the environment	damage global long success defining shown challenge way although 
2014-01-01	Protecting honey bees: identification of a new varroacide by in silico, in vitro, and in vivo studies	new molecular data amino pirimicarb acid gene vivo two 
2014-01-01	Determination of pesticide residues in honeybees using modified QUEChERS sample work-up and liquid chromatography-tandem mass spectrometry	samples method liquid mass tandem pesticides analytical limits amount 
2014-01-01	The immune response of the small interfering RNA pathway in the defense against bee viruses	viral higher major viruses intensity proportional restriction demonstrating stranded 
2014-01-01	Quantifying and mapping ecosystem services: Demand and supply of pollination in the European Union	pollination demand supply visitation agricultural crop area ecosystem spatial 
2014-01-01	Differential insecticide susceptibility of the Neotropical stingless bee Melipona quadrifasciata and the honey bee Apis mellifera	mellifera toxicity insecticides significant less realistic quadrifasciata susceptible findings 
2014-01-01	Resistance of developing honeybee larvae during chronic exposure to dietary nicotine	nicotine body stores affected development effects larvae pupal comb 
2014-01-01	Differential proteomic analysis of midguts from Nosema ceranae-infected honeybees reveals manipulation of key host functions	ceranae protein midgut host worker mass involved first invasive 
2014-01-01	A survey of managed honey bee colony losses in the Republic of South Africa - 2009 to 2011	beekeepers losses beekeeping chalkbrood significant lost subspecies using study 
2014-01-01	Results of international standardised beekeeper surveys of colony losses for winter 2012-2013: Analysis of winter loss rates and mixed effects modelling of risk factors for winter loss	effects treatment used allowing colonies colony factors treatments variation 
2014-01-01	Pathogen-associated self-medication behavior in the honeybee Apis mellifera	nurse colony compounds show larvae microsporidian also including higher 
2014-01-01	Sublethal neonicotinoid insecticide exposure reduces solitary bee reproductive success	neonicotinoid exposure effects fully present pesticide sublethal impacts fitness 
2014-01-01	Exposure to neonicotinoids influences the motor function of adult worker honeybees	motor affect doses exposure function sublethal pesticides neonicotinoids pollution 
2014-01-01	Determining the origin of invasions and demonstrating a lack of enemy release from microsporidian pathogens in common wasps (Vespula vulgaris)	infection microsporidian wasp home rates rare pathogens origin populations 
2014-01-01	Honey bee colonies act as reservoirs for two Spiroplasma facultative symbionts and incur complex, multiyear infection dynamics	species prevalence colonies current pathogens melliferum molecular apis samples 
2014-01-01	Overwintered brood comb honey: Colony exposure to pesticide residues	brood residues overwintered pesticide comb samples extracted significantly low 
2014-01-01	Host species and developmental stage, but not host social structure, affects bacterial community structure in socially polymorphic bees	social host developmental bacterial associated communities transmission species stages 
2014-01-01	Impact of chronic exposure to a pyrethroid pesticide on bumblebees and interactions with a trypanosome parasite	pesticide colony exposure impact interactions workers significant exposed survival 
2014-01-01	Bacterial chitinase with phytopathogen control capacity from suppressive soil revealed by functional metagenomics	fungal crop bacterial soil enzymes novel disease antifungal gene 
2014-01-01	Mathematical Programming Models for Determining the Optimal Location of Beehives	given models number apiary following involving locate two eusocial 
2014-01-01	Lethal and sub-lethal effects of thymol on honeybee (Apis mellifera) larvae reared in vitro	thymol food larval vitro level larvae results effects exposure 
2014-01-01	Chronic impairment of bumblebee natural foraging behaviour induced by sublethal pesticide exposure	exposure foraging chronic pesticide effects behavioural prolonged risk individual 
2014-01-01	Presence of Nosema ceranae associated with honeybee queen introductions	replacement queens species distribution observed islands ceranae presence aspects 
2014-01-01	Pesticides, food safety and integrated pest management	food pest human population negative pesticide pesticides safety land 
2014-01-01	Fifty years since silent spring	pesticide use environmental organophosphate regulation although observed pest agriculture 
2014-01-01	The 10 principles of food industry sustainability	food sustainability industry progress book potential order topic experienced 
2014-01-01	Management of whitefly-transmitted viruses in open-field production systems	disease viruses resistance production leaf become use develop crops 
2014-01-01	Insect acetylcholinesterase as a target for effective and environmentally safe insecticides	pest residue data insecticide social beneficial acetylcholinesterase insects current 
2013-12-27	Characterizing the infection-induced transcriptome of Nasonia vitripennis reveals a preponderance of taxonomically-restricted immune genes	immune genes innate identify annotation significantly novel parasitoid core 
2013-12-17	Microbial ecology of the hive and pollination landscape: Bacterial associates from floral nectar, the alimentary tract and stored food of honey bees (Apis mellifera)	bacterial core food bacteria results many beebread health identical 
2013-12-01	The body composition and enzymes of carbohydrate metabolism of Varroa destructor	content glycogen lipid mite metabolism composition basic research present 
2013-12-01	The rhizobacterium Arthrobacter agilis produces dimethylhexadecylamine, a compound that inhibits growth of phytopathogenic fungi in vitro	growth inhibit tested compound volatile effect may methyl demonstrates 
2013-12-01	Short- and long-term effects of neonicotinoid application in rice fields, on the mortality and colony collapse of honeybees (Apis mellifera)	rice dead colony distance workers hives number placed field 
2013-12-01	Effects of exposure of honey bee colonies to neonicotinoid seed-treated maize crops	maize pollen analyzed flowering colonies transferred insecticidal white mays 
2013-12-01	Toxic effects of pesticides to humans and enviroment	pesticides health may damage food also including residential environment 
2013-12-01	Towards the elements of successful insect RNAi	insect pest gene parasitic insects application disease understanding experimental 
2013-11-05	Trace level determination of pyrethroid and neonicotinoid insecticides in beebread using acetonitrile-based extraction followed by analysis with ultra-high-performance liquid chromatography-tandem mass spectrometry	liquid day method performance study pyrethroids beebread precision based 
2013-11-01	Simultaneous determination of residues in pollen and high-fructose corn syrup from eight neonicotinoid insecticides by liquid chromatography-tandem mass spectrometry	pollen method mass electrospray validated eight g potential nitenpyram 
2013-11-01	Honey bee protein atlas at organ-level resolution	us organs data together capacity reproductive whole also basic 
2013-11-01	The development, validation and application of a GC-dual detector (NPD-ECD) multi-pesticide residue method for monitoring bee poisoning incidents	pesticides pesticide used method gas matrix dispersion poisoning suspected 
2013-11-01	Production of Solitary Bees for Pollination in the United States	pollen provision visit alfalfa flowers much per nest prior 
2013-10-25	Influence of agrochemicals fipronil and imidacloprid on the learning behavior of Apis mellifera L. honeybees	learning fipronil imidacloprid determined mellifera food test ingestion although 
2013-10-24	The Effect of Olfactory Exposure to Non-Insecticidal Agrochemicals on Bumblebee Foraging Behavior	food effects foraging within agrochemical agrochemicals olfactory bumblebee environmental 
2013-10-23	A Four-Year Field Program Investigating Long-Term Effects of Repeated Exposure of Honey Bee Colonies to Flowering Crops Treated with Thiamethoxam	pollen residues nectar foraging oilseed thiamethoxam maize treatment rape 
2013-10-21	Effect of a Fungicide and Spray Adjuvant on Queen-Rearing Success in Honey Bees (Hymenoptera: Apidae)	queen spray queens treated development producers immature adjuvant nurse 
